,SENTIMENT,REVIEW,REVIEW_punctuation,REVIEW_punctuation_tokenized,REVIEW_punctuation_tokenized_sw,REVIEW_punctuation_tokenized_sw_stemmed,REVIEW_punctuation_tokenized_sw_lemmatized
247,negative,Won't work on Samsung s7 . Constantly says stopped. Not sure if linked but I do have the covid app constantly running,Wont work on Samsung s7  Constantly says stopped Not sure if linked but I do have the covid app constantly running,"['wont', 'work', 'on', 'samsung', 's7', 'constantly', 'says', 'stopped', 'not', 'sure', 'if', 'linked', 'but', 'i', 'do', 'have', 'the', 'covid', 'app', 'constantly', 'running']","['wont', 'work', 'samsung', 's7', 'constantly', 'says', 'stopped', 'sure', 'linked', 'covid', 'app', 'constantly', 'running']","['wont', 'work', 'samsung', 's7', 'constantli', 'say', 'stop', 'sure', 'link', 'covid', 'app', 'constantli', 'run']","['wont', 'work', 'samsung', 's7', 'constantly', 'say', 'stopped', 'sure', 'linked', 'covid', 'app', 'constantly', 'running']"
248,positive,Looks good with the upgrade,Looks good with the upgrade,"['looks', 'good', 'with', 'the', 'upgrade']","['looks', 'good', 'upgrade']","['look', 'good', 'upgrad']","['look', 'good', 'upgrade']"
249,positive,Great app,Great app,"['great', 'app']","['great', 'app']","['great', 'app']","['great', 'app']"
250,negative,Will not open on my Samsung Android? It keeps showing as closing. I have deleted it and resubmitted but still no go.,Will not open on my Samsung Android It keeps showing as closing I have deleted it and resubmitted but still no go,"['will', 'not', 'open', 'on', 'my', 'samsung', 'android', 'it', 'keeps', 'showing', 'as', 'closing', 'i', 'have', 'deleted', 'it', 'and', 'resubmitted', 'but', 'still', 'no', 'go']","['open', 'samsung', 'android', 'keeps', 'showing', 'closing', 'deleted', 'resubmitted', 'still', 'go']","['open', 'samsung', 'android', 'keep', 'show', 'close', 'delet', 'resubmit', 'still', 'go']","['open', 'samsung', 'android', 'keep', 'showing', 'closing', 'deleted', 'resubmitted', 'still', 'go']"
251,positive,Doesn't open. Disappointing,Doesnt open Disappointing,"['doesnt', 'open', 'disappointing']","['doesnt', 'open', 'disappointing']","['doesnt', 'open', 'disappoint']","['doesnt', 'open', 'disappointing']"
252,positive,"Great concept of the 3 words location, and has all of the important emergency numbers and instructions",Great concept of the 3 words location and has all of the important emergency numbers and instructions,"['great', 'concept', 'of', 'the', '3', 'words', 'location', 'and', 'has', 'all', 'of', 'the', 'important', 'emergency', 'numbers', 'and', 'instructions']","['great', 'concept', '3', 'words', 'location', 'important', 'emergency', 'numbers', 'instructions']","['great', 'concept', '3', 'word', 'locat', 'import', 'emerg', 'number', 'instruct']","['great', 'concept', '3', 'word', 'location', 'important', 'emergency', 'number', 'instruction']"
253,neutral,Does not open,Does not open,"['does', 'not', 'open']",['open'],['open'],['open']
254,positive,Was good. Now crashes,Was good Now crashes,"['was', 'good', 'now', 'crashes']","['good', 'crashes']","['good', 'crash']","['good', 'crash']"
255,negative,"It's showing the wrong  house, we're nextdoor",Its showing the wrong  house were nextdoor,"['its', 'showing', 'the', 'wrong', '', 'house', 'were', 'nextdoor']","['showing', 'wrong', '', 'house', 'nextdoor']","['show', 'wrong', '', 'hous', 'nextdoor']","['showing', 'wrong', '', 'house', 'nextdoor']"
256,positive,Won't open. App stopped,Wont open App stopped,"['wont', 'open', 'app', 'stopped']","['wont', 'open', 'app', 'stopped']","['wont', 'open', 'app', 'stop']","['wont', 'open', 'app', 'stopped']"
257,neutral,Crashes on startup since last update,Crashes on startup since last update,"['crashes', 'on', 'startup', 'since', 'last', 'update']","['crashes', 'startup', 'since', 'last', 'update']","['crash', 'startup', 'sinc', 'last', 'updat']","['crash', 'startup', 'since', 'last', 'update']"
258,positive,It's a great idea I have samsung 9 the app was working but suddenly stopped and i have tried closing app reloading app and turning phone off and restarting it.,Its a great idea I have samsung 9 the app was working but suddenly stopped and i have tried closing app reloading app and turning phone off and restarting it,"['its', 'a', 'great', 'idea', 'i', 'have', 'samsung', '9', 'the', 'app', 'was', 'working', 'but', 'suddenly', 'stopped', 'and', 'i', 'have', 'tried', 'closing', 'app', 'reloading', 'app', 'and', 'turning', 'phone', 'off', 'and', 'restarting', 'it']","['great', 'idea', 'samsung', '9', 'app', 'working', 'suddenly', 'stopped', 'tried', 'closing', 'app', 'reloading', 'app', 'turning', 'phone', 'restarting']","['great', 'idea', 'samsung', '9', 'app', 'work', 'suddenli', 'stop', 'tri', 'close', 'app', 'reload', 'app', 'turn', 'phone', 'restart']","['great', 'idea', 'samsung', '9', 'app', 'working', 'suddenly', 'stopped', 'tried', 'closing', 'app', 'reloading', 'app', 'turning', 'phone', 'restarting']"
259,positive,This a great App. The App has stopped working. With last update. Iam using a samsung A5.,This a great App The App has stopped working With last update Iam using a samsung A5,"['this', 'a', 'great', 'app', 'the', 'app', 'has', 'stopped', 'working', 'with', 'last', 'update', 'iam', 'using', 'a', 'samsung', 'a5']","['great', 'app', 'app', 'stopped', 'working', 'last', 'update', 'iam', 'using', 'samsung', 'a5']","['great', 'app', 'app', 'stop', 'work', 'last', 'updat', 'iam', 'use', 'samsung', 'a5']","['great', 'app', 'app', 'stopped', 'working', 'last', 'update', 'iam', 'using', 'samsung', 'a5']"
260,positive,"All very good and have had it since original version. However with the intro of What3Words the font needs to be bigger so it is more visible, especially for those that have some vision impairment . Or have the functionality to change the W3W font like the Long/Lat.",All very good and have had it since original version However with the intro of What3Words the font needs to be bigger so it is more visible especially for those that have some vision impairment  Or have the functionality to change the W3W font like the LongLat,"['all', 'very', 'good', 'and', 'have', 'had', 'it', 'since', 'original', 'version', 'however', 'with', 'the', 'intro', 'of', 'what3words', 'the', 'font', 'needs', 'to', 'be', 'bigger', 'so', 'it', 'is', 'more', 'visible', 'especially', 'for', 'those', 'that', 'have', 'some', 'vision', 'impairment', 'or', 'have', 'the', 'functionality', 'to', 'change', 'the', 'w3w', 'font', 'like', 'the', 'longlat']","['good', 'since', 'original', 'version', 'however', 'intro', 'what3words', 'font', 'needs', 'bigger', 'visible', 'especially', 'vision', 'impairment', 'functionality', 'change', 'w3w', 'font', 'like', 'longlat']","['good', 'sinc', 'origin', 'version', 'howev', 'intro', 'what3word', 'font', 'need', 'bigger', 'visibl', 'especi', 'vision', 'impair', 'function', 'chang', 'w3w', 'font', 'like', 'longlat']","['good', 'since', 'original', 'version', 'however', 'intro', 'what3words', 'font', 'need', 'bigger', 'visible', 'especially', 'vision', 'impairment', 'functionality', 'change', 'w3w', 'font', 'like', 'longlat']"
261,negative,I too have problems 'this app doesn't work anymore'. Tried in the bush today. Unsuccessful. Bit of a worry. Helen Aiton,I too have problems this app doesnt work anymore Tried in the bush today Unsuccessful Bit of a worry Helen Aiton,"['i', 'too', 'have', 'problems', 'this', 'app', 'doesnt', 'work', 'anymore', 'tried', 'in', 'the', 'bush', 'today', 'unsuccessful', 'bit', 'of', 'a', 'worry', 'helen', 'aiton']","['problems', 'app', 'doesnt', 'work', 'anymore', 'tried', 'bush', 'today', 'unsuccessful', 'bit', 'worry', 'helen', 'aiton']","['problem', 'app', 'doesnt', 'work', 'anymor', 'tri', 'bush', 'today', 'unsuccess', 'bit', 'worri', 'helen', 'aiton']","['problem', 'app', 'doesnt', 'work', 'anymore', 'tried', 'bush', 'today', 'unsuccessful', 'bit', 'worry', 'helen', 'aiton']"
262,negative,Change the original icon back!! Haven't used the app yet but the new icon will confuse people in distressing situations.,Change the original icon back Havent used the app yet but the new icon will confuse people in distressing situations,"['change', 'the', 'original', 'icon', 'back', 'havent', 'used', 'the', 'app', 'yet', 'but', 'the', 'new', 'icon', 'will', 'confuse', 'people', 'in', 'distressing', 'situations']","['change', 'original', 'icon', 'back', 'havent', 'used', 'app', 'yet', 'new', 'icon', 'confuse', 'people', 'distressing', 'situations']","['chang', 'origin', 'icon', 'back', 'havent', 'use', 'app', 'yet', 'new', 'icon', 'confus', 'peopl', 'distress', 'situat']","['change', 'original', 'icon', 'back', 'havent', 'used', 'app', 'yet', 'new', 'icon', 'confuse', 'people', 'distressing', 'situation']"
263,negative,Has now stopped working on my Galaxy running Android 8. Very disappointing,Has now stopped working on my Galaxy running Android 8 Very disappointing,"['has', 'now', 'stopped', 'working', 'on', 'my', 'galaxy', 'running', 'android', '8', 'very', 'disappointing']","['stopped', 'working', 'galaxy', 'running', 'android', '8', 'disappointing']","['stop', 'work', 'galaxi', 'run', 'android', '8', 'disappoint']","['stopped', 'working', 'galaxy', 'running', 'android', '8', 'disappointing']"
264,negative,Done update now it won't open What have you done  To bad if i have to use it,Done update now it wont open What have you done  To bad if i have to use it,"['done', 'update', 'now', 'it', 'wont', 'open', 'what', 'have', 'you', 'done', '', 'to', 'bad', 'if', 'i', 'have', 'to', 'use', 'it']","['done', 'update', 'wont', 'open', 'done', '', 'bad', 'use']","['done', 'updat', 'wont', 'open', 'done', '', 'bad', 'use']","['done', 'update', 'wont', 'open', 'done', '', 'bad', 'use']"
265,positive,Keeps saying app keeps stopping. Earlier version worked perfectly.,Keeps saying app keeps stopping Earlier version worked perfectly,"['keeps', 'saying', 'app', 'keeps', 'stopping', 'earlier', 'version', 'worked', 'perfectly']","['keeps', 'saying', 'app', 'keeps', 'stopping', 'earlier', 'version', 'worked', 'perfectly']","['keep', 'say', 'app', 'keep', 'stop', 'earlier', 'version', 'work', 'perfectli']","['keep', 'saying', 'app', 'keep', 'stopping', 'earlier', 'version', 'worked', 'perfectly']"
266,positive,Could have saved my life but doesn't work anymore,Could have saved my life but doesnt work anymore,"['could', 'have', 'saved', 'my', 'life', 'but', 'doesnt', 'work', 'anymore']","['could', 'saved', 'life', 'doesnt', 'work', 'anymore']","['could', 'save', 'life', 'doesnt', 'work', 'anymor']","['could', 'saved', 'life', 'doesnt', 'work', 'anymore']"
267,positive,"It replaced the previous triple 000 app which is perfectly works. This is not working at all. It says, the app has stopped. Please, before changing the any emergency app make sure and make sure it works perfectly. It will not be a emergency app if doesn't works.",It replaced the previous triple 000 app which is perfectly works This is not working at all It says the app has stopped Please before changing the any emergency app make sure and make sure it works perfectly It will not be a emergency app if doesnt works,"['it', 'replaced', 'the', 'previous', 'triple', '000', 'app', 'which', 'is', 'perfectly', 'works', 'this', 'is', 'not', 'working', 'at', 'all', 'it', 'says', 'the', 'app', 'has', 'stopped', 'please', 'before', 'changing', 'the', 'any', 'emergency', 'app', 'make', 'sure', 'and', 'make', 'sure', 'it', 'works', 'perfectly', 'it', 'will', 'not', 'be', 'a', 'emergency', 'app', 'if', 'doesnt', 'works']","['replaced', 'previous', 'triple', '000', 'app', 'perfectly', 'works', 'working', 'says', 'app', 'stopped', 'please', 'changing', 'emergency', 'app', 'make', 'sure', 'make', 'sure', 'works', 'perfectly', 'emergency', 'app', 'doesnt', 'works']","['replac', 'previou', 'tripl', '000', 'app', 'perfectli', 'work', 'work', 'say', 'app', 'stop', 'pleas', 'chang', 'emerg', 'app', 'make', 'sure', 'make', 'sure', 'work', 'perfectli', 'emerg', 'app', 'doesnt', 'work']","['replaced', 'previous', 'triple', '000', 'app', 'perfectly', 'work', 'working', 'say', 'app', 'stopped', 'please', 'changing', 'emergency', 'app', 'make', 'sure', 'make', 'sure', 'work', 'perfectly', 'emergency', 'app', 'doesnt', 'work']"
268,positive,After an automatic update it no longer works on my Samsung Galaxy 5. Please ensure the current version is backwardly compatible. Lives depend on its functionality.,After an automatic update it no longer works on my Samsung Galaxy 5 Please ensure the current version is backwardly compatible Lives depend on its functionality,"['after', 'an', 'automatic', 'update', 'it', 'no', 'longer', 'works', 'on', 'my', 'samsung', 'galaxy', '5', 'please', 'ensure', 'the', 'current', 'version', 'is', 'backwardly', 'compatible', 'lives', 'depend', 'on', 'its', 'functionality']","['automatic', 'update', 'longer', 'works', 'samsung', 'galaxy', '5', 'please', 'ensure', 'current', 'version', 'backwardly', 'compatible', 'lives', 'depend', 'functionality']","['automat', 'updat', 'longer', 'work', 'samsung', 'galaxi', '5', 'pleas', 'ensur', 'current', 'version', 'backwardli', 'compat', 'live', 'depend', 'function']","['automatic', 'update', 'longer', 'work', 'samsung', 'galaxy', '5', 'please', 'ensure', 'current', 'version', 'backwardly', 'compatible', 'life', 'depend', 'functionality']"
269,neutral,Not working since last update,Not working since last update,"['not', 'working', 'since', 'last', 'update']","['working', 'since', 'last', 'update']","['work', 'sinc', 'last', 'updat']","['working', 'since', 'last', 'update']"
270,negative,I can't open it at all since the very recent update. Not impressed!!!,I cant open it at all since the very recent update Not impressed,"['i', 'cant', 'open', 'it', 'at', 'all', 'since', 'the', 'very', 'recent', 'update', 'not', 'impressed']","['cant', 'open', 'since', 'recent', 'update', 'impressed']","['cant', 'open', 'sinc', 'recent', 'updat', 'impress']","['cant', 'open', 'since', 'recent', 'update', 'impressed']"
271,neutral,The updated version of this app won't open on my mobile.,The updated version of this app wont open on my mobile,"['the', 'updated', 'version', 'of', 'this', 'app', 'wont', 'open', 'on', 'my', 'mobile']","['updated', 'version', 'app', 'wont', 'open', 'mobile']","['updat', 'version', 'app', 'wont', 'open', 'mobil']","['updated', 'version', 'app', 'wont', 'open', 'mobile']"
272,negative,Have uninstalled and reinstalled the app since the update but it still doesn't work like it did prior to the update. Disappointing,Have uninstalled and reinstalled the app since the update but it still doesnt work like it did prior to the update Disappointing,"['have', 'uninstalled', 'and', 'reinstalled', 'the', 'app', 'since', 'the', 'update', 'but', 'it', 'still', 'doesnt', 'work', 'like', 'it', 'did', 'prior', 'to', 'the', 'update', 'disappointing']","['uninstalled', 'reinstalled', 'app', 'since', 'update', 'still', 'doesnt', 'work', 'like', 'prior', 'update', 'disappointing']","['uninstal', 'reinstal', 'app', 'sinc', 'updat', 'still', 'doesnt', 'work', 'like', 'prior', 'updat', 'disappoint']","['uninstalled', 'reinstalled', 'app', 'since', 'update', 'still', 'doesnt', 'work', 'like', 'prior', 'update', 'disappointing']"
273,positive,"A great app but for some reason it stopped working on my phone. Everytime I open it, it immediately crashes.",A great app but for some reason it stopped working on my phone Everytime I open it it immediately crashes,"['a', 'great', 'app', 'but', 'for', 'some', 'reason', 'it', 'stopped', 'working', 'on', 'my', 'phone', 'everytime', 'i', 'open', 'it', 'it', 'immediately', 'crashes']","['great', 'app', 'reason', 'stopped', 'working', 'phone', 'everytime', 'open', 'immediately', 'crashes']","['great', 'app', 'reason', 'stop', 'work', 'phone', 'everytim', 'open', 'immedi', 'crash']","['great', 'app', 'reason', 'stopped', 'working', 'phone', 'everytime', 'open', 'immediately', 'crash']"
274,negative,Has stopped working reinstalled and still not working,Has stopped working reinstalled and still not working,"['has', 'stopped', 'working', 'reinstalled', 'and', 'still', 'not', 'working']","['stopped', 'working', 'reinstalled', 'still', 'working']","['stop', 'work', 'reinstal', 'still', 'work']","['stopped', 'working', 'reinstalled', 'still', 'working']"
275,negative,Since you have updated the app fails to work. This meant to be an emergency app that was working perfectly before you updated it. Please repair ASAP so it can be used in an emergency,Since you have updated the app fails to work This meant to be an emergency app that was working perfectly before you updated it Please repair ASAP so it can be used in an emergency,"['since', 'you', 'have', 'updated', 'the', 'app', 'fails', 'to', 'work', 'this', 'meant', 'to', 'be', 'an', 'emergency', 'app', 'that', 'was', 'working', 'perfectly', 'before', 'you', 'updated', 'it', 'please', 'repair', 'asap', 'so', 'it', 'can', 'be', 'used', 'in', 'an', 'emergency']","['since', 'updated', 'app', 'fails', 'work', 'meant', 'emergency', 'app', 'working', 'perfectly', 'updated', 'please', 'repair', 'asap', 'used', 'emergency']","['sinc', 'updat', 'app', 'fail', 'work', 'meant', 'emerg', 'app', 'work', 'perfectli', 'updat', 'pleas', 'repair', 'asap', 'use', 'emerg']","['since', 'updated', 'app', 'fails', 'work', 'meant', 'emergency', 'app', 'working', 'perfectly', 'updated', 'please', 'repair', 'asap', 'used', 'emergency']"
276,negative,Why is this app no working anymore? It keeps crashing after the latest update,Why is this app no working anymore It keeps crashing after the latest update,"['why', 'is', 'this', 'app', 'no', 'working', 'anymore', 'it', 'keeps', 'crashing', 'after', 'the', 'latest', 'update']","['app', 'working', 'anymore', 'keeps', 'crashing', 'latest', 'update']","['app', 'work', 'anymor', 'keep', 'crash', 'latest', 'updat']","['app', 'working', 'anymore', 'keep', 'crashing', 'latest', 'update']"
277,neutral,"App won't open anymore... Reinstalled, still won't open.",App wont open anymore Reinstalled still wont open,"['app', 'wont', 'open', 'anymore', 'reinstalled', 'still', 'wont', 'open']","['app', 'wont', 'open', 'anymore', 'reinstalled', 'still', 'wont', 'open']","['app', 'wont', 'open', 'anymor', 'reinstal', 'still', 'wont', 'open']","['app', 'wont', 'open', 'anymore', 'reinstalled', 'still', 'wont', 'open']"
278,negative,This shows an incorrect address for my home. But no way to correct or advise! Dangerous.,This shows an incorrect address for my home But no way to correct or advise Dangerous,"['this', 'shows', 'an', 'incorrect', 'address', 'for', 'my', 'home', 'but', 'no', 'way', 'to', 'correct', 'or', 'advise', 'dangerous']","['shows', 'incorrect', 'address', 'home', 'way', 'correct', 'advise', 'dangerous']","['show', 'incorrect', 'address', 'home', 'way', 'correct', 'advis', 'danger']","['show', 'incorrect', 'address', 'home', 'way', 'correct', 'advise', 'dangerous']"
279,positive,This New version is not working on my Samsung Galaxy. I have checked settings all seems ok,This New version is not working on my Samsung Galaxy I have checked settings all seems ok,"['this', 'new', 'version', 'is', 'not', 'working', 'on', 'my', 'samsung', 'galaxy', 'i', 'have', 'checked', 'settings', 'all', 'seems', 'ok']","['new', 'version', 'working', 'samsung', 'galaxy', 'checked', 'settings', 'seems', 'ok']","['new', 'version', 'work', 'samsung', 'galaxi', 'check', 'set', 'seem', 'ok']","['new', 'version', 'working', 'samsung', 'galaxy', 'checked', 'setting', 'seems', 'ok']"
280,positive,Was a great app until you updated it now it wont even open,Was a great app until you updated it now it wont even open,"['was', 'a', 'great', 'app', 'until', 'you', 'updated', 'it', 'now', 'it', 'wont', 'even', 'open']","['great', 'app', 'updated', 'wont', 'even', 'open']","['great', 'app', 'updat', 'wont', 'even', 'open']","['great', 'app', 'updated', 'wont', 'even', 'open']"
281,positive,"Great app if you can open it, constantly shuts down",Great app if you can open it constantly shuts down,"['great', 'app', 'if', 'you', 'can', 'open', 'it', 'constantly', 'shuts', 'down']","['great', 'app', 'open', 'constantly', 'shuts']","['great', 'app', 'open', 'constantli', 'shut']","['great', 'app', 'open', 'constantly', 'shuts']"
282,negative,Latest version doesn't want to open on an older Android 7 based phone...stops almost immediately. Might be the same problem that the updated BoM app had for a while...,Latest version doesnt want to open on an older Android 7 based phonestops almost immediately Might be the same problem that the updated BoM app had for a while,"['latest', 'version', 'doesnt', 'want', 'to', 'open', 'on', 'an', 'older', 'android', '7', 'based', 'phonestops', 'almost', 'immediately', 'might', 'be', 'the', 'same', 'problem', 'that', 'the', 'updated', 'bom', 'app', 'had', 'for', 'a', 'while']","['latest', 'version', 'doesnt', 'want', 'open', 'older', 'android', '7', 'based', 'phonestops', 'almost', 'immediately', 'might', 'problem', 'updated', 'bom', 'app']","['latest', 'version', 'doesnt', 'want', 'open', 'older', 'android', '7', 'base', 'phonestop', 'almost', 'immedi', 'might', 'problem', 'updat', 'bom', 'app']","['latest', 'version', 'doesnt', 'want', 'open', 'older', 'android', '7', 'based', 'phonestops', 'almost', 'immediately', 'might', 'problem', 'updated', 'bom', 'app']"
283,positive,Have recently uninstalled app as it not working anymore. It won't ever load. Was great when it was working,Have recently uninstalled app as it not working anymore It wont ever load Was great when it was working,"['have', 'recently', 'uninstalled', 'app', 'as', 'it', 'not', 'working', 'anymore', 'it', 'wont', 'ever', 'load', 'was', 'great', 'when', 'it', 'was', 'working']","['recently', 'uninstalled', 'app', 'working', 'anymore', 'wont', 'ever', 'load', 'great', 'working']","['recent', 'uninstal', 'app', 'work', 'anymor', 'wont', 'ever', 'load', 'great', 'work']","['recently', 'uninstalled', 'app', 'working', 'anymore', 'wont', 'ever', 'load', 'great', 'working']"
284,neutral,Will not even load since the latest update,Will not even load since the latest update,"['will', 'not', 'even', 'load', 'since', 'the', 'latest', 'update']","['even', 'load', 'since', 'latest', 'update']","['even', 'load', 'sinc', 'latest', 'updat']","['even', 'load', 'since', 'latest', 'update']"
285,neutral,Since updating not working,Since updating not working,"['since', 'updating', 'not', 'working']","['since', 'updating', 'working']","['sinc', 'updat', 'work']","['since', 'updating', 'working']"
286,neutral,Ess we weer w we re w e et wees dw ess e wed er we see we f wwest,Ess we weer w we re w e et wees dw ess e wed er we see we f wwest,"['ess', 'we', 'weer', 'w', 'we', 're', 'w', 'e', 'et', 'wees', 'dw', 'ess', 'e', 'wed', 'er', 'we', 'see', 'we', 'f', 'wwest']","['ess', 'weer', 'w', 'w', 'e', 'et', 'wees', 'dw', 'ess', 'e', 'wed', 'er', 'see', 'f', 'wwest']","['ess', 'weer', 'w', 'w', 'e', 'et', 'wee', 'dw', 'ess', 'e', 'wed', 'er', 'see', 'f', 'wwest']","['es', 'weer', 'w', 'w', 'e', 'et', 'wee', 'dw', 'es', 'e', 'wed', 'er', 'see', 'f', 'wwest']"
287,negative,"I have installed and reinstalled this app but it still won't open. Or "" Emergency + app has stopped"". Please fix this! It's an Emergency app. The previous one worked just fine. My phone :Samsungalaxy Note 5",I have installed and reinstalled this app but it still wont open Or  Emergency  app has stopped Please fix this Its an Emergency app The previous one worked just fine My phone Samsungalaxy Note 5,"['i', 'have', 'installed', 'and', 'reinstalled', 'this', 'app', 'but', 'it', 'still', 'wont', 'open', 'or', 'emergency', 'app', 'has', 'stopped', 'please', 'fix', 'this', 'its', 'an', 'emergency', 'app', 'the', 'previous', 'one', 'worked', 'just', 'fine', 'my', 'phone', 'samsungalaxy', 'note', '5']","['installed', 'reinstalled', 'app', 'still', 'wont', 'open', 'emergency', 'app', 'stopped', 'please', 'fix', 'emergency', 'app', 'previous', 'one', 'worked', 'fine', 'phone', 'samsungalaxy', 'note', '5']","['instal', 'reinstal', 'app', 'still', 'wont', 'open', 'emerg', 'app', 'stop', 'pleas', 'fix', 'emerg', 'app', 'previou', 'one', 'work', 'fine', 'phone', 'samsungalaxi', 'note', '5']","['installed', 'reinstalled', 'app', 'still', 'wont', 'open', 'emergency', 'app', 'stopped', 'please', 'fix', 'emergency', 'app', 'previous', 'one', 'worked', 'fine', 'phone', 'samsungalaxy', 'note', '5']"
288,negative,New icon but it doesn't work any more. I have uninstalled and reinstalled but it continues to say it has stopped working. Who can fix this?,New icon but it doesnt work any more I have uninstalled and reinstalled but it continues to say it has stopped working Who can fix this,"['new', 'icon', 'but', 'it', 'doesnt', 'work', 'any', 'more', 'i', 'have', 'uninstalled', 'and', 'reinstalled', 'but', 'it', 'continues', 'to', 'say', 'it', 'has', 'stopped', 'working', 'who', 'can', 'fix', 'this']","['new', 'icon', 'doesnt', 'work', 'uninstalled', 'reinstalled', 'continues', 'say', 'stopped', 'working', 'fix']","['new', 'icon', 'doesnt', 'work', 'uninstal', 'reinstal', 'continu', 'say', 'stop', 'work', 'fix']","['new', 'icon', 'doesnt', 'work', 'uninstalled', 'reinstalled', 'continues', 'say', 'stopped', 'working', 'fix']"
