,SENTIMENT,REVIEW,REVIEW_punctuation,REVIEW_punctuation_tokenized,REVIEW_punctuation_tokenized_sw,REVIEW_punctuation_tokenized_sw_stemmed,REVIEW_punctuation_tokenized_sw_lemmatized
524,negative,"It's way off on my address, so if something happens while I'm at home I'll ring and say ""these are the gps coordinates, but they are wrong, hopefully you'll find me before it's too late"". Please fix as the gps should be dead right, not telling me I live at my neighbours over the back fence or in the street beside me. Hate for something to happen and emergency services break down someone elses door..",Its way off on my address so if something happens while Im at home Ill ring and say these are the gps coordinates but they are wrong hopefully youll find me before its too late Please fix as the gps should be dead right not telling me I live at my neighbours over the back fence or in the street beside me Hate for something to happen and emergency services break down someone elses door,"['its', 'way', 'off', 'on', 'my', 'address', 'so', 'if', 'something', 'happens', 'while', 'im', 'at', 'home', 'ill', 'ring', 'and', 'say', 'these', 'are', 'the', 'gps', 'coordinates', 'but', 'they', 'are', 'wrong', 'hopefully', 'youll', 'find', 'me', 'before', 'its', 'too', 'late', 'please', 'fix', 'as', 'the', 'gps', 'should', 'be', 'dead', 'right', 'not', 'telling', 'me', 'i', 'live', 'at', 'my', 'neighbours', 'over', 'the', 'back', 'fence', 'or', 'in', 'the', 'street', 'beside', 'me', 'hate', 'for', 'something', 'to', 'happen', 'and', 'emergency', 'services', 'break', 'down', 'someone', 'elses', 'door']","['way', 'address', 'something', 'happens', 'im', 'home', 'ill', 'ring', 'say', 'gps', 'coordinates', 'wrong', 'hopefully', 'youll', 'find', 'late', 'please', 'fix', 'gps', 'dead', 'right', 'telling', 'live', 'neighbours', 'back', 'fence', 'street', 'beside', 'hate', 'something', 'happen', 'emergency', 'services', 'break', 'someone', 'elses', 'door']","['way', 'address', 'someth', 'happen', 'im', 'home', 'ill', 'ring', 'say', 'gp', 'coordin', 'wrong', 'hope', 'youll', 'find', 'late', 'pleas', 'fix', 'gp', 'dead', 'right', 'tell', 'live', 'neighbour', 'back', 'fenc', 'street', 'besid', 'hate', 'someth', 'happen', 'emerg', 'servic', 'break', 'someon', 'els', 'door']","['way', 'address', 'something', 'happens', 'im', 'home', 'ill', 'ring', 'say', 'gps', 'coordinate', 'wrong', 'hopefully', 'youll', 'find', 'late', 'please', 'fix', 'gps', 'dead', 'right', 'telling', 'live', 'neighbour', 'back', 'fence', 'street', 'beside', 'hate', 'something', 'happen', 'emergency', 'service', 'break', 'someone', 'el', 'door']"
525,negative,Sadly it doesn't work with my Ideos running Android 2.2. Emergency button app does but it does not have the phone number or web address to send address or GPS data to.,Sadly it doesnt work with my Ideos running Android 22 Emergency button app does but it does not have the phone number or web address to send address or GPS data to,"['sadly', 'it', 'doesnt', 'work', 'with', 'my', 'ideos', 'running', 'android', '22', 'emergency', 'button', 'app', 'does', 'but', 'it', 'does', 'not', 'have', 'the', 'phone', 'number', 'or', 'web', 'address', 'to', 'send', 'address', 'or', 'gps', 'data', 'to']","['sadly', 'doesnt', 'work', 'ideos', 'running', 'android', '22', 'emergency', 'button', 'app', 'phone', 'number', 'web', 'address', 'send', 'address', 'gps', 'data']","['sadli', 'doesnt', 'work', 'ideo', 'run', 'android', '22', 'emerg', 'button', 'app', 'phone', 'number', 'web', 'address', 'send', 'address', 'gp', 'data']","['sadly', 'doesnt', 'work', 'ideos', 'running', 'android', '22', 'emergency', 'button', 'app', 'phone', 'number', 'web', 'address', 'send', 'address', 'gps', 'data']"
526,positive,Thanks,Thanks,['thanks'],['thanks'],['thank'],['thanks']
527,positive,"Location is off. Would be good if you could reposition it on the map, to make it more accurate, when needed.",Location is off Would be good if you could reposition it on the map to make it more accurate when needed,"['location', 'is', 'off', 'would', 'be', 'good', 'if', 'you', 'could', 'reposition', 'it', 'on', 'the', 'map', 'to', 'make', 'it', 'more', 'accurate', 'when', 'needed']","['location', 'would', 'good', 'could', 'reposition', 'map', 'make', 'accurate', 'needed']","['locat', 'would', 'good', 'could', 'reposit', 'map', 'make', 'accur', 'need']","['location', 'would', 'good', 'could', 'reposition', 'map', 'make', 'accurate', 'needed']"
528,positive,"Excellent, all the information you need in one place.",Excellent all the information you need in one place,"['excellent', 'all', 'the', 'information', 'you', 'need', 'in', 'one', 'place']","['excellent', 'information', 'need', 'one', 'place']","['excel', 'inform', 'need', 'one', 'place']","['excellent', 'information', 'need', 'one', 'place']"
529,negative,Gave the wrong address straight away and wouldn't let me change it,Gave the wrong address straight away and wouldnt let me change it,"['gave', 'the', 'wrong', 'address', 'straight', 'away', 'and', 'wouldnt', 'let', 'me', 'change', 'it']","['gave', 'wrong', 'address', 'straight', 'away', 'wouldnt', 'let', 'change']","['gave', 'wrong', 'address', 'straight', 'away', 'wouldnt', 'let', 'chang']","['gave', 'wrong', 'address', 'straight', 'away', 'wouldnt', 'let', 'change']"
530,negative,In case of accident app shows your GPS coordinates and all emergency phone numbers. In a Emergency the time you save could be the difference between life and death,In case of accident app shows your GPS coordinates and all emergency phone numbers In a Emergency the time you save could be the difference between life and death,"['in', 'case', 'of', 'accident', 'app', 'shows', 'your', 'gps', 'coordinates', 'and', 'all', 'emergency', 'phone', 'numbers', 'in', 'a', 'emergency', 'the', 'time', 'you', 'save', 'could', 'be', 'the', 'difference', 'between', 'life', 'and', 'death']","['case', 'accident', 'app', 'shows', 'gps', 'coordinates', 'emergency', 'phone', 'numbers', 'emergency', 'time', 'save', 'could', 'difference', 'life', 'death']","['case', 'accid', 'app', 'show', 'gp', 'coordin', 'emerg', 'phone', 'number', 'emerg', 'time', 'save', 'could', 'differ', 'life', 'death']","['case', 'accident', 'app', 'show', 'gps', 'coordinate', 'emergency', 'phone', 'number', 'emergency', 'time', 'save', 'could', 'difference', 'life', 'death']"
531,positive,This has helped me respond really well to medical emergencies,This has helped me respond really well to medical emergencies,"['this', 'has', 'helped', 'me', 'respond', 'really', 'well', 'to', 'medical', 'emergencies']","['helped', 'respond', 'really', 'well', 'medical', 'emergencies']","['help', 'respond', 'realli', 'well', 'medic', 'emerg']","['helped', 'respond', 'really', 'well', 'medical', 'emergency']"
532,positive,A welcome initiative.,A welcome initiative,"['a', 'welcome', 'initiative']","['welcome', 'initiative']","['welcom', 'initi']","['welcome', 'initiative']"
533,positive,My dad was the main person to make this and drive it forward. He had the vision to help others. This means that rescue time is cut down and your chance of survival increases,My dad was the main person to make this and drive it forward He had the vision to help others This means that rescue time is cut down and your chance of survival increases,"['my', 'dad', 'was', 'the', 'main', 'person', 'to', 'make', 'this', 'and', 'drive', 'it', 'forward', 'he', 'had', 'the', 'vision', 'to', 'help', 'others', 'this', 'means', 'that', 'rescue', 'time', 'is', 'cut', 'down', 'and', 'your', 'chance', 'of', 'survival', 'increases']","['dad', 'main', 'person', 'make', 'drive', 'forward', 'vision', 'help', 'others', 'means', 'rescue', 'time', 'cut', 'chance', 'survival', 'increases']","['dad', 'main', 'person', 'make', 'drive', 'forward', 'vision', 'help', 'other', 'mean', 'rescu', 'time', 'cut', 'chanc', 'surviv', 'increas']","['dad', 'main', 'person', 'make', 'drive', 'forward', 'vision', 'help', 'others', 'mean', 'rescue', 'time', 'cut', 'chance', 'survival', 'increase']"
534,negative,Travelling in caravan and used when drugged person tried entering van and did adjoining van. Was able to provide detailed info for area to local police to assist in location and apprehension of villian,Travelling in caravan and used when drugged person tried entering van and did adjoining van Was able to provide detailed info for area to local police to assist in location and apprehension of villian,"['travelling', 'in', 'caravan', 'and', 'used', 'when', 'drugged', 'person', 'tried', 'entering', 'van', 'and', 'did', 'adjoining', 'van', 'was', 'able', 'to', 'provide', 'detailed', 'info', 'for', 'area', 'to', 'local', 'police', 'to', 'assist', 'in', 'location', 'and', 'apprehension', 'of', 'villian']","['travelling', 'caravan', 'used', 'drugged', 'person', 'tried', 'entering', 'van', 'adjoining', 'van', 'able', 'provide', 'detailed', 'info', 'area', 'local', 'police', 'assist', 'location', 'apprehension', 'villian']","['travel', 'caravan', 'use', 'drug', 'person', 'tri', 'enter', 'van', 'adjoin', 'van', 'abl', 'provid', 'detail', 'info', 'area', 'local', 'polic', 'assist', 'locat', 'apprehens', 'villian']","['travelling', 'caravan', 'used', 'drugged', 'person', 'tried', 'entering', 'van', 'adjoining', 'van', 'able', 'provide', 'detailed', 'info', 'area', 'local', 'police', 'assist', 'location', 'apprehension', 'villian']"
535,negative,After installing I noticed my battery dropping 5% overnight for no apparent reasons. After uninstalling this my battery usage went back to normal.,After installing I noticed my battery dropping 5 overnight for no apparent reasons After uninstalling this my battery usage went back to normal,"['after', 'installing', 'i', 'noticed', 'my', 'battery', 'dropping', '5', 'overnight', 'for', 'no', 'apparent', 'reasons', 'after', 'uninstalling', 'this', 'my', 'battery', 'usage', 'went', 'back', 'to', 'normal']","['installing', 'noticed', 'battery', 'dropping', '5', 'overnight', 'apparent', 'reasons', 'uninstalling', 'battery', 'usage', 'went', 'back', 'normal']","['instal', 'notic', 'batteri', 'drop', '5', 'overnight', 'appar', 'reason', 'uninstal', 'batteri', 'usag', 'went', 'back', 'normal']","['installing', 'noticed', 'battery', 'dropping', '5', 'overnight', 'apparent', 'reason', 'uninstalling', 'battery', 'usage', 'went', 'back', 'normal']"
536,positive,Great app. I also think another useful contact to include would be poison information. Hope I never have to use it!,Great app I also think another useful contact to include would be poison information Hope I never have to use it,"['great', 'app', 'i', 'also', 'think', 'another', 'useful', 'contact', 'to', 'include', 'would', 'be', 'poison', 'information', 'hope', 'i', 'never', 'have', 'to', 'use', 'it']","['great', 'app', 'also', 'think', 'another', 'useful', 'contact', 'include', 'would', 'poison', 'information', 'hope', 'never', 'use']","['great', 'app', 'also', 'think', 'anoth', 'use', 'contact', 'includ', 'would', 'poison', 'inform', 'hope', 'never', 'use']","['great', 'app', 'also', 'think', 'another', 'useful', 'contact', 'include', 'would', 'poison', 'information', 'hope', 'never', 'use']"
537,positive,Uninstalled when it wanted me to agree to a wall of text that would take hours to read and a law degree to understand,Uninstalled when it wanted me to agree to a wall of text that would take hours to read and a law degree to understand,"['uninstalled', 'when', 'it', 'wanted', 'me', 'to', 'agree', 'to', 'a', 'wall', 'of', 'text', 'that', 'would', 'take', 'hours', 'to', 'read', 'and', 'a', 'law', 'degree', 'to', 'understand']","['uninstalled', 'wanted', 'agree', 'wall', 'text', 'would', 'take', 'hours', 'read', 'law', 'degree', 'understand']","['uninstal', 'want', 'agre', 'wall', 'text', 'would', 'take', 'hour', 'read', 'law', 'degre', 'understand']","['uninstalled', 'wanted', 'agree', 'wall', 'text', 'would', 'take', 'hour', 'read', 'law', 'degree', 'understand']"
538,neutral,Tell dispatch the longitude and latitude coordinates of your position NOT your location as it will not be 100% accurate,Tell dispatch the longitude and latitude coordinates of your position NOT your location as it will not be 100 accurate,"['tell', 'dispatch', 'the', 'longitude', 'and', 'latitude', 'coordinates', 'of', 'your', 'position', 'not', 'your', 'location', 'as', 'it', 'will', 'not', 'be', '100', 'accurate']","['tell', 'dispatch', 'longitude', 'latitude', 'coordinates', 'position', 'location', '100', 'accurate']","['tell', 'dispatch', 'longitud', 'latitud', 'coordin', 'posit', 'locat', '100', 'accur']","['tell', 'dispatch', 'longitude', 'latitude', 'coordinate', 'position', 'location', '100', 'accurate']"
539,positive,Helpful,Helpful,['helpful'],['helpful'],['help'],['helpful']
540,positive,Lifesaver,Lifesaver,['lifesaver'],['lifesaver'],['lifesav'],['lifesaver']
541,neutral,Teacher,Teacher,['teacher'],['teacher'],['teacher'],['teacher']
542,neutral,Has me living in a street off my actual street which doesnt exist. How does that even happen?,Has me living in a street off my actual street which doesnt exist How does that even happen,"['has', 'me', 'living', 'in', 'a', 'street', 'off', 'my', 'actual', 'street', 'which', 'doesnt', 'exist', 'how', 'does', 'that', 'even', 'happen']","['living', 'street', 'actual', 'street', 'doesnt', 'exist', 'even', 'happen']","['live', 'street', 'actual', 'street', 'doesnt', 'exist', 'even', 'happen']","['living', 'street', 'actual', 'street', 'doesnt', 'exist', 'even', 'happen']"
543,positive,Looks like a great app however iam in a new estate and maps not the latest. Sent email hopefully fixed soon.,Looks like a great app however iam in a new estate and maps not the latest Sent email hopefully fixed soon,"['looks', 'like', 'a', 'great', 'app', 'however', 'iam', 'in', 'a', 'new', 'estate', 'and', 'maps', 'not', 'the', 'latest', 'sent', 'email', 'hopefully', 'fixed', 'soon']","['looks', 'like', 'great', 'app', 'however', 'iam', 'new', 'estate', 'maps', 'latest', 'sent', 'email', 'hopefully', 'fixed', 'soon']","['look', 'like', 'great', 'app', 'howev', 'iam', 'new', 'estat', 'map', 'latest', 'sent', 'email', 'hope', 'fix', 'soon']","['look', 'like', 'great', 'app', 'however', 'iam', 'new', 'estate', 'map', 'latest', 'sent', 'email', 'hopefully', 'fixed', 'soon']"
544,neutral,For Australia,For Australia,"['for', 'australia']",['australia'],['australia'],['australia']
545,negative,Emergency,Emergency,['emergency'],['emergency'],['emerg'],['emergency']
546,neutral,What you should have,What you should have,"['what', 'you', 'should', 'have']",[],[],[]
547,neutral,I was able to quickly get an ambulance and tell them exactly where to come.. This app helped someone this week.,I was able to quickly get an ambulance and tell them exactly where to come This app helped someone this week,"['i', 'was', 'able', 'to', 'quickly', 'get', 'an', 'ambulance', 'and', 'tell', 'them', 'exactly', 'where', 'to', 'come', 'this', 'app', 'helped', 'someone', 'this', 'week']","['able', 'quickly', 'get', 'ambulance', 'tell', 'exactly', 'come', 'app', 'helped', 'someone', 'week']","['abl', 'quickli', 'get', 'ambul', 'tell', 'exactli', 'come', 'app', 'help', 'someon', 'week']","['able', 'quickly', 'get', 'ambulance', 'tell', 'exactly', 'come', 'app', 'helped', 'someone', 'week']"
548,positive,"Definitely worth having, but needs some refinement. NSW 000 dispatchers were unable to get an Ambulance directly to an off-road location in Sydney Olympic Park in Jan 2016.. The dispatcher reported their maps do not show the off-road walkways and cycle paths that are clearly available on the app, and googlemaps and openstreetmaps. Or did he transcribe the coordinates incorrectly ? It appeared the dispatcher was not looking at the same map as we could see on the app. It would vastly improve communication if the application were able to upload the coordinates to the 000 dispatchers via an internet or SMS link. It would also be a very useful extension if the application could share the coordinates via SMS or internet links to Council or National Park Rangers etc.,. who may need to unlock gates for ambulance and police to reach incident sites.",Definitely worth having but needs some refinement NSW 000 dispatchers were unable to get an Ambulance directly to an offroad location in Sydney Olympic Park in Jan 2016 The dispatcher reported their maps do not show the offroad walkways and cycle paths that are clearly available on the app and googlemaps and openstreetmaps Or did he transcribe the coordinates incorrectly  It appeared the dispatcher was not looking at the same map as we could see on the app It would vastly improve communication if the application were able to upload the coordinates to the 000 dispatchers via an internet or SMS link It would also be a very useful extension if the application could share the coordinates via SMS or internet links to Council or National Park Rangers etc who may need to unlock gates for ambulance and police to reach incident sites,"['definitely', 'worth', 'having', 'but', 'needs', 'some', 'refinement', 'nsw', '000', 'dispatchers', 'were', 'unable', 'to', 'get', 'an', 'ambulance', 'directly', 'to', 'an', 'offroad', 'location', 'in', 'sydney', 'olympic', 'park', 'in', 'jan', '2016', 'the', 'dispatcher', 'reported', 'their', 'maps', 'do', 'not', 'show', 'the', 'offroad', 'walkways', 'and', 'cycle', 'paths', 'that', 'are', 'clearly', 'available', 'on', 'the', 'app', 'and', 'googlemaps', 'and', 'openstreetmaps', 'or', 'did', 'he', 'transcribe', 'the', 'coordinates', 'incorrectly', 'it', 'appeared', 'the', 'dispatcher', 'was', 'not', 'looking', 'at', 'the', 'same', 'map', 'as', 'we', 'could', 'see', 'on', 'the', 'app', 'it', 'would', 'vastly', 'improve', 'communication', 'if', 'the', 'application', 'were', 'able', 'to', 'upload', 'the', 'coordinates', 'to', 'the', '000', 'dispatchers', 'via', 'an', 'internet', 'or', 'sms', 'link', 'it', 'would', 'also', 'be', 'a', 'very', 'useful', 'extension', 'if', 'the', 'application', 'could', 'share', 'the', 'coordinates', 'via', 'sms', 'or', 'internet', 'links', 'to', 'council', 'or', 'national', 'park', 'rangers', 'etc', 'who', 'may', 'need', 'to', 'unlock', 'gates', 'for', 'ambulance', 'and', 'police', 'to', 'reach', 'incident', 'sites']","['definitely', 'worth', 'needs', 'refinement', 'nsw', '000', 'dispatchers', 'unable', 'get', 'ambulance', 'directly', 'offroad', 'location', 'sydney', 'olympic', 'park', 'jan', '2016', 'dispatcher', 'reported', 'maps', 'show', 'offroad', 'walkways', 'cycle', 'paths', 'clearly', 'available', 'app', 'googlemaps', 'openstreetmaps', 'transcribe', 'coordinates', 'incorrectly', 'appeared', 'dispatcher', 'looking', 'map', 'could', 'see', 'app', 'would', 'vastly', 'improve', 'communication', 'application', 'able', 'upload', 'coordinates', '000', 'dispatchers', 'via', 'internet', 'sms', 'link', 'would', 'also', 'useful', 'extension', 'application', 'could', 'share', 'coordinates', 'via', 'sms', 'internet', 'links', 'council', 'national', 'park', 'rangers', 'etc', 'may', 'need', 'unlock', 'gates', 'ambulance', 'police', 'reach', 'incident', 'sites']","['definit', 'worth', 'need', 'refin', 'nsw', '000', 'dispatch', 'unabl', 'get', 'ambul', 'directli', 'offroad', 'locat', 'sydney', 'olymp', 'park', 'jan', '2016', 'dispatch', 'report', 'map', 'show', 'offroad', 'walkway', 'cycl', 'path', 'clearli', 'avail', 'app', 'googlemap', 'openstreetmap', 'transcrib', 'coordin', 'incorrectli', 'appear', 'dispatch', 'look', 'map', 'could', 'see', 'app', 'would', 'vastli', 'improv', 'commun', 'applic', 'abl', 'upload', 'coordin', '000', 'dispatch', 'via', 'internet', 'sm', 'link', 'would', 'also', 'use', 'extens', 'applic', 'could', 'share', 'coordin', 'via', 'sm', 'internet', 'link', 'council', 'nation', 'park', 'ranger', 'etc', 'may', 'need', 'unlock', 'gate', 'ambul', 'polic', 'reach', 'incid', 'site']","['definitely', 'worth', 'need', 'refinement', 'nsw', '000', 'dispatcher', 'unable', 'get', 'ambulance', 'directly', 'offroad', 'location', 'sydney', 'olympic', 'park', 'jan', '2016', 'dispatcher', 'reported', 'map', 'show', 'offroad', 'walkway', 'cycle', 'path', 'clearly', 'available', 'app', 'googlemaps', 'openstreetmaps', 'transcribe', 'coordinate', 'incorrectly', 'appeared', 'dispatcher', 'looking', 'map', 'could', 'see', 'app', 'would', 'vastly', 'improve', 'communication', 'application', 'able', 'upload', 'coordinate', '000', 'dispatcher', 'via', 'internet', 'sm', 'link', 'would', 'also', 'useful', 'extension', 'application', 'could', 'share', 'coordinate', 'via', 'sm', 'internet', 'link', 'council', 'national', 'park', 'ranger', 'etc', 'may', 'need', 'unlock', 'gate', 'ambulance', 'police', 'reach', 'incident', 'site']"
549,positive,Great app,Great app,"['great', 'app']","['great', 'app']","['great', 'app']","['great', 'app']"
550,negative,"Brings up correct position on map but lists the wrong adress. States im 10 houses away, around the corner and opposite side of the road! Im a rescue volunteer, these errors cost time and lives!",Brings up correct position on map but lists the wrong adress States im 10 houses away around the corner and opposite side of the road Im a rescue volunteer these errors cost time and lives,"['brings', 'up', 'correct', 'position', 'on', 'map', 'but', 'lists', 'the', 'wrong', 'adress', 'states', 'im', '10', 'houses', 'away', 'around', 'the', 'corner', 'and', 'opposite', 'side', 'of', 'the', 'road', 'im', 'a', 'rescue', 'volunteer', 'these', 'errors', 'cost', 'time', 'and', 'lives']","['brings', 'correct', 'position', 'map', 'lists', 'wrong', 'adress', 'states', 'im', '10', 'houses', 'away', 'around', 'corner', 'opposite', 'side', 'road', 'im', 'rescue', 'volunteer', 'errors', 'cost', 'time', 'lives']","['bring', 'correct', 'posit', 'map', 'list', 'wrong', 'adress', 'state', 'im', '10', 'hous', 'away', 'around', 'corner', 'opposit', 'side', 'road', 'im', 'rescu', 'volunt', 'error', 'cost', 'time', 'live']","['brings', 'correct', 'position', 'map', 'list', 'wrong', 'adress', 'state', 'im', '10', 'house', 'away', 'around', 'corner', 'opposite', 'side', 'road', 'im', 'rescue', 'volunteer', 'error', 'cost', 'time', 'life']"
551,positive,As a SES member I find it useful most of the time,As a SES member I find it useful most of the time,"['as', 'a', 'ses', 'member', 'i', 'find', 'it', 'useful', 'most', 'of', 'the', 'time']","['ses', 'member', 'find', 'useful', 'time']","['se', 'member', 'find', 'use', 'time']","['s', 'member', 'find', 'useful', 'time']"
552,negative,"It's a strange concept to download a app hoping to never need it, good on you developers for making this app",Its a strange concept to download a app hoping to never need it good on you developers for making this app,"['its', 'a', 'strange', 'concept', 'to', 'download', 'a', 'app', 'hoping', 'to', 'never', 'need', 'it', 'good', 'on', 'you', 'developers', 'for', 'making', 'this', 'app']","['strange', 'concept', 'download', 'app', 'hoping', 'never', 'need', 'good', 'developers', 'making', 'app']","['strang', 'concept', 'download', 'app', 'hope', 'never', 'need', 'good', 'develop', 'make', 'app']","['strange', 'concept', 'download', 'app', 'hoping', 'never', 'need', 'good', 'developer', 'making', 'app']"
553,positive,Very useful with all relevant information.,Very useful with all relevant information,"['very', 'useful', 'with', 'all', 'relevant', 'information']","['useful', 'relevant', 'information']","['use', 'relev', 'inform']","['useful', 'relevant', 'information']"
554,negative,Putty Rd is notorious for 2 things. Limited phone coverage and motorcycle accidents. This app helped to save a mates life last weekend,Putty Rd is notorious for 2 things Limited phone coverage and motorcycle accidents This app helped to save a mates life last weekend,"['putty', 'rd', 'is', 'notorious', 'for', '2', 'things', 'limited', 'phone', 'coverage', 'and', 'motorcycle', 'accidents', 'this', 'app', 'helped', 'to', 'save', 'a', 'mates', 'life', 'last', 'weekend']","['putty', 'rd', 'notorious', '2', 'things', 'limited', 'phone', 'coverage', 'motorcycle', 'accidents', 'app', 'helped', 'save', 'mates', 'life', 'last', 'weekend']","['putti', 'rd', 'notori', '2', 'thing', 'limit', 'phone', 'coverag', 'motorcycl', 'accid', 'app', 'help', 'save', 'mate', 'life', 'last', 'weekend']","['putty', 'rd', 'notorious', '2', 'thing', 'limited', 'phone', 'coverage', 'motorcycle', 'accident', 'app', 'helped', 'save', 'mate', 'life', 'last', 'weekend']"
555,negative,Great app but will not give my correct address how can I change my house number and unit number these are new unit block 10 months old.,Great app but will not give my correct address how can I change my house number and unit number these are new unit block 10 months old,"['great', 'app', 'but', 'will', 'not', 'give', 'my', 'correct', 'address', 'how', 'can', 'i', 'change', 'my', 'house', 'number', 'and', 'unit', 'number', 'these', 'are', 'new', 'unit', 'block', '10', 'months', 'old']","['great', 'app', 'give', 'correct', 'address', 'change', 'house', 'number', 'unit', 'number', 'new', 'unit', 'block', '10', 'months', 'old']","['great', 'app', 'give', 'correct', 'address', 'chang', 'hous', 'number', 'unit', 'number', 'new', 'unit', 'block', '10', 'month', 'old']","['great', 'app', 'give', 'correct', 'address', 'change', 'house', 'number', 'unit', 'number', 'new', 'unit', 'block', '10', 'month', 'old']"
556,neutral,Wont download on my Samsung galaxy core?,Wont download on my Samsung galaxy core,"['wont', 'download', 'on', 'my', 'samsung', 'galaxy', 'core']","['wont', 'download', 'samsung', 'galaxy', 'core']","['wont', 'download', 'samsung', 'galaxi', 'core']","['wont', 'download', 'samsung', 'galaxy', 'core']"
