,SENTIMENT,REVIEW,REVIEW_punctuation,REVIEW_punctuation_tokenized,REVIEW_punctuation_tokenized_sw,REVIEW_punctuation_tokenized_sw_stemmed,REVIEW_punctuation_tokenized_sw_lemmatized
767,positive,"The new app icon is much less emergencyish. I dont like it at all. The old one stood out as a click me now emergency button. The new one blends in. Ill forget Ive got it. In an emergency situation an app you can find super quickly is really important as you may not be thinking straight. 
Otherwise I still like the app.","The new app icon is much less emergencyish I dont like it at all The old one stood out as a click me now emergency button The new one blends in Ill forget Ive got it In an emergency situation an app you can find super quickly is really important as you may not be thinking straight 
Otherwise I still like the app","['the', 'new', 'app', 'icon', 'is', 'much', 'less', '', 'emergencyish', 'i', 'don', 't', 'like', 'it', 'at', 'all', 'the', 'old', 'one', 'stood', 'out', 'as', 'a', '', 'click', 'me', 'now', 'emergency', 'button', 'the', 'new', 'one', 'blends', 'in', 'i', 'll', 'forget', 'i', 've', 'got', 'it', 'in', 'an', 'emergency', 'situation', 'an', 'app', 'you', 'can', 'find', 'super', 'quickly', 'is', 'really', 'important', 'as', 'you', 'may', 'not', 'be', 'thinking', 'straight', 'otherwise', 'i', 'still', 'like', 'the', 'app']","['new', 'app', 'icon', 'much', 'less', '', 'emergencyish', 'don', 'like', 'old', 'one', 'stood', '', 'click', 'now', 'emergency', 'button', 'new', 'one', 'blends', 'i', 'forget', 'i', 'got', 'emergency', 'situation', 'app', 'find', 'super', 'quickly', 'really', 'important', 'may', 'thinking', 'straight', 'otherwise', 'still', 'like', 'app']","['new', 'app', 'icon', 'much', 'less', '', 'emergencyish', 'don', 'like', 'old', 'one', 'stood', '', 'click', 'now', 'emerg', 'button', 'new', 'one', 'blend', 'i', 'forget', 'i', 'got', 'emerg', 'situat', 'app', 'find', 'super', 'quickli', 'realli', 'import', 'may', 'think', 'straight', 'otherwis', 'still', 'like', 'app']","['new', 'app', 'icon', 'much', 'le', '', 'emergencyish', 'don', 'like', 'old', 'one', 'stood', '', 'click', 'now', 'emergency', 'button', 'new', 'one', 'blend', 'i', 'forget', 'i', 'got', 'emergency', 'situation', 'app', 'find', 'super', 'quickly', 'really', 'important', 'may', 'thinking', 'straight', 'otherwise', 'still', 'like', 'app']"
768,positive,"Great app :-) I would also like to see the Military Grid Reference System added with long / latitude. 
Messaging option would also be a great feature to have also.","Great app  I would also like to see the Military Grid Reference System added with long  latitude 
Messaging option would also be a great feature to have also","['great', 'app', 'i', 'would', 'also', 'like', 'to', 'see', 'the', 'military', 'grid', 'reference', 'system', 'added', 'with', 'long', 'latitude', 'messaging', 'option', 'would', 'also', 'be', 'a', 'great', 'feature', 'to', 'have', 'also']","['great', 'app', 'would', 'also', 'like', 'see', 'military', 'grid', 'reference', 'system', 'added', 'long', 'latitude', 'messaging', 'option', 'would', 'also', 'great', 'feature', 'also']","['great', 'app', 'would', 'also', 'like', 'see', 'militari', 'grid', 'refer', 'system', 'ad', 'long', 'latitud', 'messag', 'option', 'would', 'also', 'great', 'featur', 'also']","['great', 'app', 'would', 'also', 'like', 'see', 'military', 'grid', 'reference', 'system', 'added', 'long', 'latitude', 'messaging', 'option', 'would', 'also', 'great', 'feature', 'also']"
769,positive,"Concept and execution is great. However, I think it could be improved by adding the WhatThreeWords location in addition to the GPS coordinates. In stressful situations, quoting three short words is often easier to articulate than a string of numbers.",Concept and execution is great However I think it could be improved by adding the WhatThreeWords location in addition to the GPS coordinates In stressful situations quoting three short words is often easier to articulate than a string of numbers,"['concept', 'and', 'execution', 'is', 'great', 'however', 'i', 'think', 'it', 'could', 'be', 'improved', 'by', 'adding', 'the', 'whatthreewords', 'location', 'in', 'addition', 'to', 'the', 'gps', 'coordinates', 'in', 'stressful', 'situations', 'quoting', 'three', 'short', 'words', 'is', 'often', 'easier', 'to', 'articulate', 'than', 'a', 'string', 'of', 'numbers']","['concept', 'execution', 'great', 'however', 'think', 'could', 'improved', 'adding', 'whatthreewords', 'location', 'addition', 'gps', 'coordinates', 'stressful', 'situations', 'quoting', 'three', 'short', 'words', 'often', 'easier', 'articulate', 'string', 'numbers']","['concept', 'execut', 'great', 'howev', 'think', 'could', 'improv', 'ad', 'whatthreeword', 'locat', 'addit', 'gp', 'coordin', 'stress', 'situat', 'quot', 'three', 'short', 'word', 'often', 'easier', 'articul', 'string', 'number']","['concept', 'execution', 'great', 'however', 'think', 'could', 'improved', 'adding', 'whatthreewords', 'location', 'addition', 'gps', 'coordinate', 'stressful', 'situation', 'quoting', 'three', 'short', 'word', 'often', 'easier', 'articulate', 'string', 'number']"
770,positive,"This is a great app. It would be even better if we were able to nominate it to not be archived to the cloud automatically if not used.. because you dont need it, until you do!",This is a great app It would be even better if we were able to nominate it to not be archived to the cloud automatically if not used because you dont need it until you do,"['this', 'is', 'a', 'great', 'app', 'it', 'would', 'be', 'even', 'better', 'if', 'we', 'were', 'able', 'to', 'nominate', 'it', 'to', 'not', 'be', 'archived', 'to', 'the', 'cloud', 'automatically', 'if', 'not', 'used', 'because', 'you', 'don', 't', 'need', 'it', 'until', 'you', 'do']","['great', 'app', 'would', 'even', 'better', 'able', 'nominate', 'archived', 'cloud', 'automatically', 'used', 'don', 'need']","['great', 'app', 'would', 'even', 'better', 'abl', 'nomin', 'archiv', 'cloud', 'automat', 'use', 'don', 'need']","['great', 'app', 'would', 'even', 'better', 'able', 'nominate', 'archived', 'cloud', 'automatically', 'used', 'don', 'need']"
771,positive,Great concept guys. We are frequent interstate holiday drivers and have come upon not so nice truck drivers harassing motorists in certain parts between rural NSW and VIC. Knowing where I am exactly can help in reporting trucks or accidents! I will be recommending this to friends and family.,Great concept guys We are frequent interstate holiday drivers and have come upon not so nice truck drivers harassing motorists in certain parts between rural NSW and VIC Knowing where I am exactly can help in reporting trucks or accidents I will be recommending this to friends and family,"['great', 'concept', 'guys', 'we', 'are', 'frequent', 'interstate', 'holiday', 'drivers', 'and', 'have', 'come', 'upon', 'not', 'so', 'nice', 'truck', 'drivers', 'harassing', 'motorists', 'in', 'certain', 'parts', 'between', 'rural', 'nsw', 'and', 'vic', 'knowing', 'where', 'i', 'am', 'exactly', 'can', 'help', 'in', 'reporting', 'trucks', 'or', 'accidents', 'i', 'will', 'be', 'recommending', 'this', 'to', 'friends', 'and', 'family']","['great', 'concept', 'guys', 'frequent', 'interstate', 'holiday', 'drivers', 'come', 'upon', 'nice', 'truck', 'drivers', 'harassing', 'motorists', 'certain', 'parts', 'rural', 'nsw', 'vic', 'knowing', 'exactly', 'help', 'reporting', 'trucks', 'accidents', 'recommending', 'friends', 'family']","['great', 'concept', 'guy', 'frequent', 'interst', 'holiday', 'driver', 'come', 'upon', 'nice', 'truck', 'driver', 'harass', 'motorist', 'certain', 'part', 'rural', 'nsw', 'vic', 'know', 'exactli', 'help', 'report', 'truck', 'accid', 'recommend', 'friend', 'famili']","['great', 'concept', 'guy', 'frequent', 'interstate', 'holiday', 'driver', 'come', 'upon', 'nice', 'truck', 'driver', 'harassing', 'motorist', 'certain', 'part', 'rural', 'nsw', 'vic', 'knowing', 'exactly', 'help', 'reporting', 'truck', 'accident', 'recommending', 'friend', 'family']"
772,positive,"I love the concept of the app and recommend it to friends, just hope I never have to use it.
The GPS font size adjustment is great but I don't understand why you don't adjust the street address below it using the same setting.","I love the concept of the app and recommend it to friends just hope I never have to use it
The GPS font size adjustment is great but I dont understand why you dont adjust the street address below it using the same setting","['i', 'love', 'the', 'concept', 'of', 'the', 'app', 'and', 'recommend', 'it', 'to', 'friends', 'just', 'hope', 'i', 'never', 'have', 'to', 'use', 'it', 'the', 'gps', 'font', 'size', 'adjustment', 'is', 'great', 'but', 'i', 'dont', 'understand', 'why', 'you', 'dont', 'adjust', 'the', 'street', 'address', 'below', 'it', 'using', 'the', 'same', 'setting']","['love', 'concept', 'app', 'recommend', 'friends', 'hope', 'never', 'use', 'gps', 'font', 'size', 'adjustment', 'great', 'dont', 'understand', 'dont', 'adjust', 'street', 'address', 'using', 'setting']","['love', 'concept', 'app', 'recommend', 'friend', 'hope', 'never', 'use', 'gp', 'font', 'size', 'adjust', 'great', 'dont', 'understand', 'dont', 'adjust', 'street', 'address', 'use', 'set']","['love', 'concept', 'app', 'recommend', 'friend', 'hope', 'never', 'use', 'gps', 'font', 'size', 'adjustment', 'great', 'dont', 'understand', 'dont', 'adjust', 'street', 'address', 'using', 'setting']"
773,positive,"The app was so helpful.
It gives a perfect location every time.
The app has heaps of great features but, the app looks a bit tacky and there are buttons that I dont know what they do.
There are also no instructions on what buttons do so please fix this!!!
Overall I really like this app. Thanks!","The app was so helpful
It gives a perfect location every time
The app has heaps of great features but the app looks a bit tacky and there are buttons that I dont know what they do
There are also no instructions on what buttons do so please fix this
Overall I really like this app Thanks","['the', 'app', 'was', 'so', 'helpful', 'it', 'gives', 'a', 'perfect', 'location', 'every', 'time', 'the', 'app', 'has', 'heaps', 'of', 'great', 'features', 'but', 'the', 'app', 'looks', 'a', 'bit', 'tacky', 'and', 'there', 'are', 'buttons', 'that', 'i', 'don', 't', 'know', 'what', 'they', 'do', 'there', 'are', 'also', 'no', 'instructions', 'on', 'what', 'buttons', 'do', 'so', 'please', 'fix', 'this', 'overall', 'i', 'really', 'like', 'this', 'app', 'thanks', '']","['app', 'helpful', 'gives', 'perfect', 'location', 'every', 'time', 'app', 'heaps', 'great', 'features', 'app', 'looks', 'bit', 'tacky', 'buttons', 'don', 'know', 'also', 'instructions', 'buttons', 'please', 'fix', 'overall', 'really', 'like', 'app', 'thanks', '']","['app', 'help', 'give', 'perfect', 'locat', 'everi', 'time', 'app', 'heap', 'great', 'featur', 'app', 'look', 'bit', 'tacki', 'button', 'don', 'know', 'also', 'instruct', 'button', 'pleas', 'fix', 'overal', 'realli', 'like', 'app', 'thanks', '']","['app', 'helpful', 'give', 'perfect', 'location', 'every', 'time', 'app', 'heap', 'great', 'feature', 'app', 'look', 'bit', 'tacky', 'button', 'don', 'know', 'also', 'instruction', 'button', 'please', 'fix', 'overall', 'really', 'like', 'app', 'thanks', '']"
774,positive,"Great app. Is it possible for the app to have greater accessibility functionality to support individuals who may not be able to identify their location, understand the operator and/or see/say the 3 words. 
Thank you","Great app Is it possible for the app to have greater accessibility functionality to support individuals who may not be able to identify their location understand the operator andor seesay the 3 words 
Thank you","['great', 'app', 'is', 'it', 'possible', 'for', 'the', 'app', 'to', 'have', 'greater', 'accessibility', 'functionality', 'to', 'support', 'individuals', 'who', 'may', 'not', 'be', 'able', 'to', 'identify', 'their', 'location', 'understand', 'the', 'operator', 'andor', 'seesay', 'the', '3', 'words', 'thank', 'you']","['great', 'app', 'possible', 'app', 'greater', 'accessibility', 'functionality', 'support', 'individuals', 'may', 'able', 'identify', 'location', 'understand', 'operator', 'andor', 'seesay', '3', 'words', 'thank']","['great', 'app', 'possibl', 'app', 'greater', 'access', 'function', 'support', 'individu', 'may', 'abl', 'identifi', 'locat', 'understand', 'oper', 'andor', 'seesay', '3', 'word', 'thank']","['great', 'app', 'possible', 'app', 'greater', 'accessibility', 'functionality', 'support', 'individual', 'may', 'able', 'identify', 'location', 'understand', 'operator', 'andor', 'seesay', '3', 'word', 'thank']"
775,negative,"Today, I got caught up in a traffic accident in rural SE QLD and needed to call the emergency services but had no idea how to describe where I was. I called 000 and used the app to give the operator the co-ordinates. Thanks so much a real life saver! Two patients quickly located and taken to hospital.",Today I got caught up in a traffic accident in rural SE QLD and needed to call the emergency services but had no idea how to describe where I was I called 000 and used the app to give the operator the coordinates Thanks so much a real life saver Two patients quickly located and taken to hospital,"['today', 'i', 'got', 'caught', 'up', 'in', 'a', 'traffic', 'accident', 'in', 'rural', 'se', 'qld', 'and', 'needed', 'to', 'call', 'the', 'emergency', 'services', 'but', 'had', 'no', 'idea', 'how', 'to', 'describe', 'where', 'i', 'was', 'i', 'called', '000', 'and', 'used', 'the', 'app', 'to', 'give', 'the', 'operator', 'the', 'coordinates', 'thanks', 'so', 'much', 'a', 'real', 'life', 'saver', 'two', 'patients', 'quickly', 'located', 'and', 'taken', 'to', 'hospital']","['today', 'got', 'caught', 'traffic', 'accident', 'rural', 'se', 'qld', 'needed', 'call', 'emergency', 'services', 'idea', 'describe', 'called', '000', 'used', 'app', 'give', 'operator', 'coordinates', 'thanks', 'much', 'real', 'life', 'saver', 'two', 'patients', 'quickly', 'located', 'taken', 'hospital']","['today', 'got', 'caught', 'traffic', 'accid', 'rural', 'se', 'qld', 'need', 'call', 'emerg', 'servic', 'idea', 'describ', 'call', '000', 'use', 'app', 'give', 'oper', 'coordin', 'thank', 'much', 'real', 'life', 'saver', 'two', 'patient', 'quickli', 'locat', 'taken', 'hospit']","['today', 'got', 'caught', 'traffic', 'accident', 'rural', 'se', 'qld', 'needed', 'call', 'emergency', 'service', 'idea', 'describe', 'called', '000', 'used', 'app', 'give', 'operator', 'coordinate', 'thanks', 'much', 'real', 'life', 'saver', 'two', 'patient', 'quickly', 'located', 'taken', 'hospital']"
776,positive,I think you guys should approach Apple and make this app available in control centre so when phone is locked other people can use it still as that would help save life's and responds times,I think you guys should approach Apple and make this app available in control centre so when phone is locked other people can use it still as that would help save lifes and responds times,"['i', 'think', 'you', 'guys', 'should', 'approach', 'apple', 'and', 'make', 'this', 'app', 'available', 'in', 'control', 'centre', 'so', 'when', 'phone', 'is', 'locked', 'other', 'people', 'can', 'use', 'it', 'still', 'as', 'that', 'would', 'help', 'save', 'lifes', 'and', 'responds', 'times']","['think', 'guys', 'approach', 'apple', 'make', 'app', 'available', 'control', 'centre', 'phone', 'locked', 'people', 'use', 'still', 'would', 'help', 'save', 'lifes', 'responds', 'times']","['think', 'guy', 'approach', 'appl', 'make', 'app', 'avail', 'control', 'centr', 'phone', 'lock', 'peopl', 'use', 'still', 'would', 'help', 'save', 'life', 'respond', 'time']","['think', 'guy', 'approach', 'apple', 'make', 'app', 'available', 'control', 'centre', 'phone', 'locked', 'people', 'use', 'still', 'would', 'help', 'save', 'life', 'responds', 'time']"
777,positive,"This app is the only app on my phone I hope I never have to use!
Ive read everything on this app that I can find to read on it & without having used it, I still say its the best app in my phone.","This app is the only app on my phone I hope I never have to use
Ive read everything on this app that I can find to read on it  without having used it I still say its the best app in my phone","['this', 'app', 'is', 'the', 'only', 'app', 'on', 'my', 'phone', 'i', 'hope', 'i', 'never', 'have', 'to', 'use', 'i', 've', 'read', 'everything', 'on', 'this', 'app', 'that', 'i', 'can', 'find', 'to', 'read', 'on', 'it', 'without', 'having', 'used', 'it', 'i', 'still', 'say', 'it', 's', 'the', 'best', 'app', 'in', 'my', 'phone']","['app', 'app', 'phone', 'hope', 'never', 'use', 'i', 'read', 'everything', 'app', 'find', 'read', 'without', 'used', 'still', 'say', 'it', 'best', 'app', 'phone']","['app', 'app', 'phone', 'hope', 'never', 'use', 'i', 'read', 'everyth', 'app', 'find', 'read', 'without', 'use', 'still', 'say', 'it', 'best', 'app', 'phone']","['app', 'app', 'phone', 'hope', 'never', 'use', 'i', 'read', 'everything', 'app', 'find', 'read', 'without', 'used', 'still', 'say', 'it', 'best', 'app', 'phone']"
778,neutral,"I thought that the What Three Words software gave a unique set of 3 words to reference a specific map location, but when I tested this on 2 mobile phones sitting next to each other, the latitude and longitude were the same but the three words were different. Is this meant to occur?",I thought that the What Three Words software gave a unique set of 3 words to reference a specific map location but when I tested this on 2 mobile phones sitting next to each other the latitude and longitude were the same but the three words were different Is this meant to occur,"['i', 'thought', 'that', 'the', 'what', 'three', 'words', 'software', 'gave', 'a', 'unique', 'set', 'of', '3', 'words', 'to', 'reference', 'a', 'specific', 'map', 'location', 'but', 'when', 'i', 'tested', 'this', 'on', '2', 'mobile', 'phones', 'sitting', 'next', 'to', 'each', 'other', 'the', 'latitude', 'and', 'longitude', 'were', 'the', 'same', 'but', 'the', 'three', 'words', 'were', 'different', 'is', 'this', 'meant', 'to', 'occur']","['thought', 'three', 'words', 'software', 'gave', 'unique', 'set', '3', 'words', 'reference', 'specific', 'map', 'location', 'tested', '2', 'mobile', 'phones', 'sitting', 'next', 'latitude', 'longitude', 'three', 'words', 'different', 'meant', 'occur']","['thought', 'three', 'word', 'softwar', 'gave', 'uniqu', 'set', '3', 'word', 'refer', 'specif', 'map', 'locat', 'test', '2', 'mobil', 'phone', 'sit', 'next', 'latitud', 'longitud', 'three', 'word', 'differ', 'meant', 'occur']","['thought', 'three', 'word', 'software', 'gave', 'unique', 'set', '3', 'word', 'reference', 'specific', 'map', 'location', 'tested', '2', 'mobile', 'phone', 'sitting', 'next', 'latitude', 'longitude', 'three', 'word', 'different', 'meant', 'occur']"
779,positive,"Emergency plus is a great app with a wonderful idea. My only suggestion is to include the number for the DAN (river alert network), so people in SCUBA emergencies know who to call. Otherwise a literal life saver app",Emergency plus is a great app with a wonderful idea My only suggestion is to include the number for the DAN river alert network so people in SCUBA emergencies know who to call Otherwise a literal life saver app,"['emergency', 'plus', 'is', 'a', 'great', 'app', 'with', 'a', 'wonderful', 'idea', 'my', 'only', 'suggestion', 'is', 'to', 'include', 'the', 'number', 'for', 'the', 'dan', 'river', 'alert', 'network', 'so', 'people', 'in', 'scuba', 'emergencies', 'know', 'who', 'to', 'call', 'otherwise', 'a', 'literal', 'life', 'saver', 'app']","['emergency', 'plus', 'great', 'app', 'wonderful', 'idea', 'suggestion', 'include', 'number', 'dan', 'river', 'alert', 'network', 'people', 'scuba', 'emergencies', 'know', 'call', 'otherwise', 'literal', 'life', 'saver', 'app']","['emerg', 'plu', 'great', 'app', 'wonder', 'idea', 'suggest', 'includ', 'number', 'dan', 'river', 'alert', 'network', 'peopl', 'scuba', 'emerg', 'know', 'call', 'otherwis', 'liter', 'life', 'saver', 'app']","['emergency', 'plus', 'great', 'app', 'wonderful', 'idea', 'suggestion', 'include', 'number', 'dan', 'river', 'alert', 'network', 'people', 'scuba', 'emergency', 'know', 'call', 'otherwise', 'literal', 'life', 'saver', 'app']"
780,negative,"How can this be? It shows blue dot in correct place of my home, but the address named is a 3 minute walk away across a park. I then entered into Google Maps the GPS coordinates listed in the app as being my location. It also shows that the blue dot is where I am but the Emergency app address that I am supposed to give to a responder is not where I am. !!!",How can this be It shows blue dot in correct place of my home but the address named is a 3 minute walk away across a park I then entered into Google Maps the GPS coordinates listed in the app as being my location It also shows that the blue dot is where I am but the Emergency app address that I am supposed to give to a responder is not where I am ,"['how', 'can', 'this', 'be', 'it', 'shows', 'blue', 'dot', 'in', 'correct', 'place', 'of', 'my', 'home', 'but', 'the', 'address', 'named', 'is', 'a', '3', 'minute', 'walk', 'away', 'across', 'a', 'park', 'i', 'then', 'entered', 'into', 'google', 'maps', 'the', 'gps', 'coordinates', 'listed', 'in', 'the', 'app', 'as', 'being', 'my', 'location', 'it', 'also', 'shows', 'that', 'the', 'blue', 'dot', 'is', 'where', 'i', 'am', 'but', 'the', 'emergency', 'app', 'address', 'that', 'i', 'am', 'supposed', 'to', 'give', 'to', 'a', 'responder', 'is', 'not', 'where', 'i', 'am', '']","['shows', 'blue', 'dot', 'correct', 'place', 'home', 'address', 'named', '3', 'minute', 'walk', 'away', 'across', 'park', 'entered', 'google', 'maps', 'gps', 'coordinates', 'listed', 'app', 'location', 'also', 'shows', 'blue', 'dot', 'emergency', 'app', 'address', 'supposed', 'give', 'responder', '']","['show', 'blue', 'dot', 'correct', 'place', 'home', 'address', 'name', '3', 'minut', 'walk', 'away', 'across', 'park', 'enter', 'googl', 'map', 'gp', 'coordin', 'list', 'app', 'locat', 'also', 'show', 'blue', 'dot', 'emerg', 'app', 'address', 'suppos', 'give', 'respond', '']","['show', 'blue', 'dot', 'correct', 'place', 'home', 'address', 'named', '3', 'minute', 'walk', 'away', 'across', 'park', 'entered', 'google', 'map', 'gps', 'coordinate', 'listed', 'app', 'location', 'also', 'show', 'blue', 'dot', 'emergency', 'app', 'address', 'supposed', 'give', 'responder', '']"
781,positive,Great app so simple to use definitely a lifesaver would love to have it on my watch as I dont always have my phone within hands reach.,Great app so simple to use definitely a lifesaver would love to have it on my watch as I dont always have my phone within hands reach,"['great', 'app', 'so', 'simple', 'to', 'use', 'definitely', 'a', 'lifesaver', 'would', 'love', 'to', 'have', 'it', 'on', 'my', 'watch', 'as', 'i', 'don', 't', 'always', 'have', 'my', 'phone', 'within', 'hands', 'reach']","['great', 'app', 'simple', 'use', 'definitely', 'lifesaver', 'would', 'love', 'watch', 'don', 'always', 'phone', 'within', 'hands', 'reach']","['great', 'app', 'simpl', 'use', 'definit', 'lifesav', 'would', 'love', 'watch', 'don', 'alway', 'phone', 'within', 'hand', 'reach']","['great', 'app', 'simple', 'use', 'definitely', 'lifesaver', 'would', 'love', 'watch', 'don', 'always', 'phone', 'within', 'hand', 'reach']"
782,negative,Came across accident on country road no knowing where you relaid gps cordinates to operator and pin pointed out location to the meter. Saved a lot of time in trying to describe where we were,Came across accident on country road no knowing where you relaid gps cordinates to operator and pin pointed out location to the meter Saved a lot of time in trying to describe where we were,"['came', 'across', 'accident', 'on', 'country', 'road', 'no', 'knowing', 'where', 'you', 'relaid', 'gps', 'cordinates', 'to', 'operator', 'and', 'pin', 'pointed', 'out', 'location', 'to', 'the', 'meter', 'saved', 'a', 'lot', 'of', 'time', 'in', 'trying', 'to', 'describe', 'where', 'we', 'were']","['came', 'across', 'accident', 'country', 'road', 'knowing', 'relaid', 'gps', 'cordinates', 'operator', 'pin', 'pointed', 'location', 'meter', 'saved', 'lot', 'time', 'trying', 'describe']","['came', 'across', 'accid', 'countri', 'road', 'know', 'relaid', 'gp', 'cordin', 'oper', 'pin', 'point', 'locat', 'meter', 'save', 'lot', 'time', 'tri', 'describ']","['came', 'across', 'accident', 'country', 'road', 'knowing', 'relaid', 'gps', 'cordinates', 'operator', 'pin', 'pointed', 'location', 'meter', 'saved', 'lot', 'time', 'trying', 'describe']"
783,positive,"This has been a really handy app to have, but since the update, it wont stay open. Crashes after a few seconds, even after deleting and re-installing. Please fix.",This has been a really handy app to have but since the update it wont stay open Crashes after a few seconds even after deleting and reinstalling Please fix,"['this', 'has', 'been', 'a', 'really', 'handy', 'app', 'to', 'have', 'but', 'since', 'the', 'update', 'it', 'won', 't', 'stay', 'open', 'crashes', 'after', 'a', 'few', 'seconds', 'even', 'after', 'deleting', 'and', 'reinstalling', 'please', 'fix']","['really', 'handy', 'app', 'since', 'update', 'won', 'stay', 'open', 'crashes', 'seconds', 'even', 'deleting', 'reinstalling', 'please', 'fix']","['realli', 'handi', 'app', 'sinc', 'updat', 'won', 'stay', 'open', 'crash', 'second', 'even', 'delet', 'reinstal', 'pleas', 'fix']","['really', 'handy', 'app', 'since', 'update', 'won', 'stay', 'open', 'crash', 'second', 'even', 'deleting', 'reinstalling', 'please', 'fix']"
