,SENTIMENT,REVIEW,REVIEW_punctuation,REVIEW_punctuation_tokenized,REVIEW_punctuation_tokenized_sw,REVIEW_punctuation_tokenized_sw_stemmed,REVIEW_punctuation_tokenized_sw_lemmatized
0,negative,Gives wrong address so how do I know the rest is correct.,Gives wrong address so how do I know the rest is correct,"['gives', 'wrong', 'address', 'so', 'how', 'do', 'i', 'know', 'the', 'rest', 'is', 'correct']","['gives', 'wrong', 'address', 'know', 'rest', 'correct']","['give', 'wrong', 'address', 'know', 'rest', 'correct']","['give', 'wrong', 'address', 'know', 'rest', 'correct']"
1,negative,"Locates correctly but can give an address 800m / 8 streets away. ""Last updated"" text can also be odd: ie ""19 years ago"". Must have to let it take time to settle down. SGS10.",Locates correctly but can give an address 800m  8 streets away Last updated text can also be odd ie 19 years ago Must have to let it take time to settle down SGS10,"['locates', 'correctly', 'but', 'can', 'give', 'an', 'address', '800m', '8', 'streets', 'away', 'last', 'updated', 'text', 'can', 'also', 'be', 'odd', 'ie', '19', 'years', 'ago', 'must', 'have', 'to', 'let', 'it', 'take', 'time', 'to', 'settle', 'down', 'sgs10']","['locates', 'correctly', 'give', 'address', '800m', '8', 'streets', 'away', 'last', 'updated', 'text', 'also', 'odd', 'ie', '19', 'years', 'ago', 'must', 'let', 'take', 'time', 'settle', 'sgs10']","['locat', 'correctli', 'give', 'address', '800m', '8', 'street', 'away', 'last', 'updat', 'text', 'also', 'odd', 'ie', '19', 'year', 'ago', 'must', 'let', 'take', 'time', 'settl', 'sgs10']","['locates', 'correctly', 'give', 'address', '800m', '8', 'street', 'away', 'last', 'updated', 'text', 'also', 'odd', 'ie', '19', 'year', 'ago', 'must', 'let', 'take', 'time', 'settle', 'sgs10']"
2,positive,A good thank you,A good thank you,"['a', 'good', 'thank', 'you']","['good', 'thank']","['good', 'thank']","['good', 'thank']"
3,neutral,We,We,['we'],[],[],[]
4,neutral,handy to have,handy to have,"['handy', 'to', 'have']",['handy'],['handi'],['handy']
5,negative,"Rendering assistance to a lone dehydrated aged sailor at water's edge reporting as a ""concern for welfare"". Frustratingly with no road and no x-street to pass to 000 it was simple as saying Alpha, Bravo, Charlie where GPS and three words was spot on in guiding the ambulance close. ""if we can't find you we can't rescue you"", and day or night not all calls for assistance come with an observable street address or for that matter even on ""Land"", that's within a three metre square. Well done W3W.",Rendering assistance to a lone dehydrated aged sailor at waters edge reporting as a concern for welfare Frustratingly with no road and no xstreet to pass to 000 it was simple as saying Alpha Bravo Charlie where GPS and three words was spot on in guiding the ambulance close if we cant find you we cant rescue you and day or night not all calls for assistance come with an observable street address or for that matter even on Land thats within a three metre square Well done W3W,"['rendering', 'assistance', 'to', 'a', 'lone', 'dehydrated', 'aged', 'sailor', 'at', 'waters', 'edge', 'reporting', 'as', 'a', 'concern', 'for', 'welfare', 'frustratingly', 'with', 'no', 'road', 'and', 'no', 'xstreet', 'to', 'pass', 'to', '000', 'it', 'was', 'simple', 'as', 'saying', 'alpha', 'bravo', 'charlie', 'where', 'gps', 'and', 'three', 'words', 'was', 'spot', 'on', 'in', 'guiding', 'the', 'ambulance', 'close', 'if', 'we', 'cant', 'find', 'you', 'we', 'cant', 'rescue', 'you', 'and', 'day', 'or', 'night', 'not', 'all', 'calls', 'for', 'assistance', 'come', 'with', 'an', 'observable', 'street', 'address', 'or', 'for', 'that', 'matter', 'even', 'on', 'land', 'thats', 'within', 'a', 'three', 'metre', 'square', 'well', 'done', 'w3w']","['rendering', 'assistance', 'lone', 'dehydrated', 'aged', 'sailor', 'waters', 'edge', 'reporting', 'concern', 'welfare', 'frustratingly', 'road', 'xstreet', 'pass', '000', 'simple', 'saying', 'alpha', 'bravo', 'charlie', 'gps', 'three', 'words', 'spot', 'guiding', 'ambulance', 'close', 'cant', 'find', 'cant', 'rescue', 'day', 'night', 'calls', 'assistance', 'come', 'observable', 'street', 'address', 'matter', 'even', 'land', 'thats', 'within', 'three', 'metre', 'square', 'well', 'done', 'w3w']","['render', 'assist', 'lone', 'dehydr', 'age', 'sailor', 'water', 'edg', 'report', 'concern', 'welfar', 'frustratingli', 'road', 'xstreet', 'pass', '000', 'simpl', 'say', 'alpha', 'bravo', 'charli', 'gp', 'three', 'word', 'spot', 'guid', 'ambul', 'close', 'cant', 'find', 'cant', 'rescu', 'day', 'night', 'call', 'assist', 'come', 'observ', 'street', 'address', 'matter', 'even', 'land', 'that', 'within', 'three', 'metr', 'squar', 'well', 'done', 'w3w']","['rendering', 'assistance', 'lone', 'dehydrated', 'aged', 'sailor', 'water', 'edge', 'reporting', 'concern', 'welfare', 'frustratingly', 'road', 'xstreet', 'pas', '000', 'simple', 'saying', 'alpha', 'bravo', 'charlie', 'gps', 'three', 'word', 'spot', 'guiding', 'ambulance', 'close', 'cant', 'find', 'cant', 'rescue', 'day', 'night', 'call', 'assistance', 'come', 'observable', 'street', 'address', 'matter', 'even', 'land', 'thats', 'within', 'three', 'metre', 'square', 'well', 'done', 'w3w']"
6,negative,Great app. Sister put me onto it. Shame there is no way to update the home location as a gps location does work for when you are multi level residential building.,Great app Sister put me onto it Shame there is no way to update the home location as a gps location does work for when you are multi level residential building,"['great', 'app', 'sister', 'put', 'me', 'onto', 'it', 'shame', 'there', 'is', 'no', 'way', 'to', 'update', 'the', 'home', 'location', 'as', 'a', 'gps', 'location', 'does', 'work', 'for', 'when', 'you', 'are', 'multi', 'level', 'residential', 'building']","['great', 'app', 'sister', 'put', 'onto', 'shame', 'way', 'update', 'home', 'location', 'gps', 'location', 'work', 'multi', 'level', 'residential', 'building']","['great', 'app', 'sister', 'put', 'onto', 'shame', 'way', 'updat', 'home', 'locat', 'gp', 'locat', 'work', 'multi', 'level', 'residenti', 'build']","['great', 'app', 'sister', 'put', 'onto', 'shame', 'way', 'update', 'home', 'location', 'gps', 'location', 'work', 'multi', 'level', 'residential', 'building']"
7,negative,"Dangerous app. It thinks I am at my old address, some 50km from where I actually am. GPS won't update. Waze picks up my location correctly so it isn't a GPS or phone issue. This app is dangerous, it could send emergency services to the wrong location. It would be safer not to have the app and use street signs or landmarks or GPS coordinates from your phone to report your location.",Dangerous app It thinks I am at my old address some 50km from where I actually am GPS wont update Waze picks up my location correctly so it isnt a GPS or phone issue This app is dangerous it could send emergency services to the wrong location It would be safer not to have the app and use street signs or landmarks or GPS coordinates from your phone to report your location,"['dangerous', 'app', 'it', 'thinks', 'i', 'am', 'at', 'my', 'old', 'address', 'some', '50km', 'from', 'where', 'i', 'actually', 'am', 'gps', 'wont', 'update', 'waze', 'picks', 'up', 'my', 'location', 'correctly', 'so', 'it', 'isnt', 'a', 'gps', 'or', 'phone', 'issue', 'this', 'app', 'is', 'dangerous', 'it', 'could', 'send', 'emergency', 'services', 'to', 'the', 'wrong', 'location', 'it', 'would', 'be', 'safer', 'not', 'to', 'have', 'the', 'app', 'and', 'use', 'street', 'signs', 'or', 'landmarks', 'or', 'gps', 'coordinates', 'from', 'your', 'phone', 'to', 'report', 'your', 'location']","['dangerous', 'app', 'thinks', 'old', 'address', '50km', 'actually', 'gps', 'wont', 'update', 'waze', 'picks', 'location', 'correctly', 'isnt', 'gps', 'phone', 'issue', 'app', 'dangerous', 'could', 'send', 'emergency', 'services', 'wrong', 'location', 'would', 'safer', 'app', 'use', 'street', 'signs', 'landmarks', 'gps', 'coordinates', 'phone', 'report', 'location']","['danger', 'app', 'think', 'old', 'address', '50km', 'actual', 'gp', 'wont', 'updat', 'waze', 'pick', 'locat', 'correctli', 'isnt', 'gp', 'phone', 'issu', 'app', 'danger', 'could', 'send', 'emerg', 'servic', 'wrong', 'locat', 'would', 'safer', 'app', 'use', 'street', 'sign', 'landmark', 'gp', 'coordin', 'phone', 'report', 'locat']","['dangerous', 'app', 'think', 'old', 'address', '50km', 'actually', 'gps', 'wont', 'update', 'waze', 'pick', 'location', 'correctly', 'isnt', 'gps', 'phone', 'issue', 'app', 'dangerous', 'could', 'send', 'emergency', 'service', 'wrong', 'location', 'would', 'safer', 'app', 'use', 'street', 'sign', 'landmark', 'gps', 'coordinate', 'phone', 'report', 'location']"
8,positive,Great 'just in case' app. Truncation of 'what three words' in primary and map screen may be problematic (unless font size significantly reduced impacting vision impaired individuals). When tapping info box from map screen all text increases in size and often pushes last of the 'three words' out of view/access. Better highlighting of additional services accessible through the menu may also assist those who haven't explored app prior to their emergency/crisis.,Great just in case app Truncation of what three words in primary and map screen may be problematic unless font size significantly reduced impacting vision impaired individuals When tapping info box from map screen all text increases in size and often pushes last of the three words out of viewaccess Better highlighting of additional services accessible through the menu may also assist those who havent explored app prior to their emergencycrisis,"['great', 'just', 'in', 'case', 'app', 'truncation', 'of', 'what', 'three', 'words', 'in', 'primary', 'and', 'map', 'screen', 'may', 'be', 'problematic', 'unless', 'font', 'size', 'significantly', 'reduced', 'impacting', 'vision', 'impaired', 'individuals', 'when', 'tapping', 'info', 'box', 'from', 'map', 'screen', 'all', 'text', 'increases', 'in', 'size', 'and', 'often', 'pushes', 'last', 'of', 'the', 'three', 'words', 'out', 'of', 'viewaccess', 'better', 'highlighting', 'of', 'additional', 'services', 'accessible', 'through', 'the', 'menu', 'may', 'also', 'assist', 'those', 'who', 'havent', 'explored', 'app', 'prior', 'to', 'their', 'emergencycrisis']","['great', 'case', 'app', 'truncation', 'three', 'words', 'primary', 'map', 'screen', 'may', 'problematic', 'unless', 'font', 'size', 'significantly', 'reduced', 'impacting', 'vision', 'impaired', 'individuals', 'tapping', 'info', 'box', 'map', 'screen', 'text', 'increases', 'size', 'often', 'pushes', 'last', 'three', 'words', 'viewaccess', 'better', 'highlighting', 'additional', 'services', 'accessible', 'menu', 'may', 'also', 'assist', 'havent', 'explored', 'app', 'prior', 'emergencycrisis']","['great', 'case', 'app', 'truncat', 'three', 'word', 'primari', 'map', 'screen', 'may', 'problemat', 'unless', 'font', 'size', 'significantli', 'reduc', 'impact', 'vision', 'impair', 'individu', 'tap', 'info', 'box', 'map', 'screen', 'text', 'increas', 'size', 'often', 'push', 'last', 'three', 'word', 'viewaccess', 'better', 'highlight', 'addit', 'servic', 'access', 'menu', 'may', 'also', 'assist', 'havent', 'explor', 'app', 'prior', 'emergencycrisi']","['great', 'case', 'app', 'truncation', 'three', 'word', 'primary', 'map', 'screen', 'may', 'problematic', 'unless', 'font', 'size', 'significantly', 'reduced', 'impacting', 'vision', 'impaired', 'individual', 'tapping', 'info', 'box', 'map', 'screen', 'text', 'increase', 'size', 'often', 'push', 'last', 'three', 'word', 'viewaccess', 'better', 'highlighting', 'additional', 'service', 'accessible', 'menu', 'may', 'also', 'assist', 'havent', 'explored', 'app', 'prior', 'emergencycrisis']"
9,positive,This is truly a life saving app,This is truly a life saving app,"['this', 'is', 'truly', 'a', 'life', 'saving', 'app']","['truly', 'life', 'saving', 'app']","['truli', 'life', 'save', 'app']","['truly', 'life', 'saving', 'app']"
10,positive,Saved my life twice now how do you recommend it LIFE SAVING,Saved my life twice now how do you recommend it LIFE SAVING,"['saved', 'my', 'life', 'twice', 'now', 'how', 'do', 'you', 'recommend', 'it', 'life', 'saving']","['saved', 'life', 'twice', 'recommend', 'life', 'saving']","['save', 'life', 'twice', 'recommend', 'life', 'save']","['saved', 'life', 'twice', 'recommend', 'life', 'saving']"
11,positive,"The app isn't working right since last update. Map and numbers are half covered up and can't read 3 words at all as its so small. Please bring back the older version, or explain how I can revert it back as it no longer works",The app isnt working right since last update Map and numbers are half covered up and cant read 3 words at all as its so small Please bring back the older version or explain how I can revert it back as it no longer works,"['the', 'app', 'isnt', 'working', 'right', 'since', 'last', 'update', 'map', 'and', 'numbers', 'are', 'half', 'covered', 'up', 'and', 'cant', 'read', '3', 'words', 'at', 'all', 'as', 'its', 'so', 'small', 'please', 'bring', 'back', 'the', 'older', 'version', 'or', 'explain', 'how', 'i', 'can', 'revert', 'it', 'back', 'as', 'it', 'no', 'longer', 'works']","['app', 'isnt', 'working', 'right', 'since', 'last', 'update', 'map', 'numbers', 'half', 'covered', 'cant', 'read', '3', 'words', 'small', 'please', 'bring', 'back', 'older', 'version', 'explain', 'revert', 'back', 'longer', 'works']","['app', 'isnt', 'work', 'right', 'sinc', 'last', 'updat', 'map', 'number', 'half', 'cover', 'cant', 'read', '3', 'word', 'small', 'pleas', 'bring', 'back', 'older', 'version', 'explain', 'revert', 'back', 'longer', 'work']","['app', 'isnt', 'working', 'right', 'since', 'last', 'update', 'map', 'number', 'half', 'covered', 'cant', 'read', '3', 'word', 'small', 'please', 'bring', 'back', 'older', 'version', 'explain', 'revert', 'back', 'longer', 'work']"
12,negative,I just installed this and it has me at the wrong address,I just installed this and it has me at the wrong address,"['i', 'just', 'installed', 'this', 'and', 'it', 'has', 'me', 'at', 'the', 'wrong', 'address']","['installed', 'wrong', 'address']","['instal', 'wrong', 'address']","['installed', 'wrong', 'address']"
13,neutral,life saving,life saving,"['life', 'saving']","['life', 'saving']","['life', 'save']","['life', 'saving']"
14,neutral,"As a motorcycle rider,this is an invaluable app to have on my phone",As a motorcycle riderthis is an invaluable app to have on my phone,"['as', 'a', 'motorcycle', 'riderthis', 'is', 'an', 'invaluable', 'app', 'to', 'have', 'on', 'my', 'phone']","['motorcycle', 'riderthis', 'invaluable', 'app', 'phone']","['motorcycl', 'riderthi', 'invalu', 'app', 'phone']","['motorcycle', 'riderthis', 'invaluable', 'app', 'phone']"
15,neutral,"Crashes, unable to open",Crashes unable to open,"['crashes', 'unable', 'to', 'open']","['crashes', 'unable', 'open']","['crash', 'unabl', 'open']","['crash', 'unable', 'open']"
16,negative,"Location is about 500m out. In a residential area, this would have emergency services turning up to the wrong house -in my case half a block away and the wrong side of the street!",Location is about 500m out In a residential area this would have emergency services turning up to the wrong house in my case half a block away and the wrong side of the street,"['location', 'is', 'about', '500m', 'out', 'in', 'a', 'residential', 'area', 'this', 'would', 'have', 'emergency', 'services', 'turning', 'up', 'to', 'the', 'wrong', 'house', 'in', 'my', 'case', 'half', 'a', 'block', 'away', 'and', 'the', 'wrong', 'side', 'of', 'the', 'street']","['location', '500m', 'residential', 'area', 'would', 'emergency', 'services', 'turning', 'wrong', 'house', 'case', 'half', 'block', 'away', 'wrong', 'side', 'street']","['locat', '500m', 'residenti', 'area', 'would', 'emerg', 'servic', 'turn', 'wrong', 'hous', 'case', 'half', 'block', 'away', 'wrong', 'side', 'street']","['location', '500m', 'residential', 'area', 'would', 'emergency', 'service', 'turning', 'wrong', 'house', 'case', 'half', 'block', 'away', 'wrong', 'side', 'street']"
17,negative,This is a must have. If your unsure of the address were the emergency is just touch the app. There it is. All you need to get help.,This is a must have If your unsure of the address were the emergency is just touch the app There it is All you need to get help,"['this', 'is', 'a', 'must', 'have', 'if', 'your', 'unsure', 'of', 'the', 'address', 'were', 'the', 'emergency', 'is', 'just', 'touch', 'the', 'app', 'there', 'it', 'is', 'all', 'you', 'need', 'to', 'get', 'help']","['must', 'unsure', 'address', 'emergency', 'touch', 'app', 'need', 'get', 'help']","['must', 'unsur', 'address', 'emerg', 'touch', 'app', 'need', 'get', 'help']","['must', 'unsure', 'address', 'emergency', 'touch', 'app', 'need', 'get', 'help']"
18,positive,Most useful feature of the app GPS cordinates of the current location which is useful in an emergency.,Most useful feature of the app GPS cordinates of the current location which is useful in an emergency,"['most', 'useful', 'feature', 'of', 'the', 'app', 'gps', 'cordinates', 'of', 'the', 'current', 'location', 'which', 'is', 'useful', 'in', 'an', 'emergency']","['useful', 'feature', 'app', 'gps', 'cordinates', 'current', 'location', 'useful', 'emergency']","['use', 'featur', 'app', 'gp', 'cordin', 'current', 'locat', 'use', 'emerg']","['useful', 'feature', 'app', 'gps', 'cordinates', 'current', 'location', 'useful', 'emergency']"
19,positive,Most impressed,Most impressed,"['most', 'impressed']",['impressed'],['impress'],['impressed']
20,positive,Awesome app great to have on your phone,Awesome app great to have on your phone,"['awesome', 'app', 'great', 'to', 'have', 'on', 'your', 'phone']","['awesome', 'app', 'great', 'phone']","['awesom', 'app', 'great', 'phone']","['awesome', 'app', 'great', 'phone']"
21,neutral,"Not displaying my location correctly, more than 3km out.",Not displaying my location correctly more than 3km out,"['not', 'displaying', 'my', 'location', 'correctly', 'more', 'than', '3km', 'out']","['displaying', 'location', 'correctly', '3km']","['display', 'locat', 'correctli', '3km']","['displaying', 'location', 'correctly', '3km']"
22,negative,"Your app sometimes displays the ""what3words"" text wrong between the ""Home"" screen and the ""My Location"" screen. At times on the ""My Location"" screen, the 3rd word is missing letters at the end of the word. But on the ""Home"" screen all letters appear. Thus, different words can be displayed when at the same location on the 2 different screens. If this review is monitored and your require clarification I have screenshots to illustrate.",Your app sometimes displays the what3words text wrong between the Home screen and the My Location screen At times on the My Location screen the 3rd word is missing letters at the end of the word But on the Home screen all letters appear Thus different words can be displayed when at the same location on the 2 different screens If this review is monitored and your require clarification I have screenshots to illustrate,"['your', 'app', 'sometimes', 'displays', 'the', 'what3words', 'text', 'wrong', 'between', 'the', 'home', 'screen', 'and', 'the', 'my', 'location', 'screen', 'at', 'times', 'on', 'the', 'my', 'location', 'screen', 'the', '3rd', 'word', 'is', 'missing', 'letters', 'at', 'the', 'end', 'of', 'the', 'word', 'but', 'on', 'the', 'home', 'screen', 'all', 'letters', 'appear', 'thus', 'different', 'words', 'can', 'be', 'displayed', 'when', 'at', 'the', 'same', 'location', 'on', 'the', '2', 'different', 'screens', 'if', 'this', 'review', 'is', 'monitored', 'and', 'your', 'require', 'clarification', 'i', 'have', 'screenshots', 'to', 'illustrate']","['app', 'sometimes', 'displays', 'what3words', 'text', 'wrong', 'home', 'screen', 'location', 'screen', 'times', 'location', 'screen', '3rd', 'word', 'missing', 'letters', 'end', 'word', 'home', 'screen', 'letters', 'appear', 'thus', 'different', 'words', 'displayed', 'location', '2', 'different', 'screens', 'review', 'monitored', 'require', 'clarification', 'screenshots', 'illustrate']","['app', 'sometim', 'display', 'what3word', 'text', 'wrong', 'home', 'screen', 'locat', 'screen', 'time', 'locat', 'screen', '3rd', 'word', 'miss', 'letter', 'end', 'word', 'home', 'screen', 'letter', 'appear', 'thu', 'differ', 'word', 'display', 'locat', '2', 'differ', 'screen', 'review', 'monitor', 'requir', 'clarif', 'screenshot', 'illustr']","['app', 'sometimes', 'display', 'what3words', 'text', 'wrong', 'home', 'screen', 'location', 'screen', 'time', 'location', 'screen', '3rd', 'word', 'missing', 'letter', 'end', 'word', 'home', 'screen', 'letter', 'appear', 'thus', 'different', 'word', 'displayed', 'location', '2', 'different', 'screen', 'review', 'monitored', 'require', 'clarification', 'screenshots', 'illustrate']"
23,positive,Awesome... everyone should have this app as it may just save your life or the life of a loved one .,Awesome everyone should have this app as it may just save your life or the life of a loved one ,"['awesome', 'everyone', 'should', 'have', 'this', 'app', 'as', 'it', 'may', 'just', 'save', 'your', 'life', 'or', 'the', 'life', 'of', 'a', 'loved', 'one', '']","['awesome', 'everyone', 'app', 'may', 'save', 'life', 'life', 'loved', 'one', '']","['awesom', 'everyon', 'app', 'may', 'save', 'life', 'life', 'love', 'one', '']","['awesome', 'everyone', 'app', 'may', 'save', 'life', 'life', 'loved', 'one', '']"
24,positive,Thank you You,Thank you You,"['thank', 'you', 'you']",['thank'],['thank'],['thank']
25,negative,"Info blurb says (in the ""app permissions"" section) that you can disable access to permissions in settings. After downloading, the ONLY settings option is to change the font size of GPS coordinates... a blatant lie - not cool. Why should this app need access to the storage of my phone??",Info blurb says in the app permissions section that you can disable access to permissions in settings After downloading the ONLY settings option is to change the font size of GPS coordinates a blatant lie  not cool Why should this app need access to the storage of my phone,"['info', 'blurb', 'says', 'in', 'the', 'app', 'permissions', 'section', 'that', 'you', 'can', 'disable', 'access', 'to', 'permissions', 'in', 'settings', 'after', 'downloading', 'the', 'only', 'settings', 'option', 'is', 'to', 'change', 'the', 'font', 'size', 'of', 'gps', 'coordinates', 'a', 'blatant', 'lie', 'not', 'cool', 'why', 'should', 'this', 'app', 'need', 'access', 'to', 'the', 'storage', 'of', 'my', 'phone']","['info', 'blurb', 'says', 'app', 'permissions', 'section', 'disable', 'access', 'permissions', 'settings', 'downloading', 'settings', 'option', 'change', 'font', 'size', 'gps', 'coordinates', 'blatant', 'lie', 'cool', 'app', 'need', 'access', 'storage', 'phone']","['info', 'blurb', 'say', 'app', 'permiss', 'section', 'disabl', 'access', 'permiss', 'set', 'download', 'set', 'option', 'chang', 'font', 'size', 'gp', 'coordin', 'blatant', 'lie', 'cool', 'app', 'need', 'access', 'storag', 'phone']","['info', 'blurb', 'say', 'app', 'permission', 'section', 'disable', 'access', 'permission', 'setting', 'downloading', 'setting', 'option', 'change', 'font', 'size', 'gps', 'coordinate', 'blatant', 'lie', 'cool', 'app', 'need', 'access', 'storage', 'phone']"
26,negative,"The so is generally good. I'd give it 5 stars but... the app has no exit option. Once started this app runs continuously until a Force Stop is used in settings, applications. This app only needs to run on demand NOT continuously. Please fix this flaw. It affects battery.",The so is generally good Id give it 5 stars but the app has no exit option Once started this app runs continuously until a Force Stop is used in settings applications This app only needs to run on demand NOT continuously Please fix this flaw It affects battery,"['the', 'so', 'is', 'generally', 'good', 'id', 'give', 'it', '5', 'stars', 'but', 'the', 'app', 'has', 'no', 'exit', 'option', 'once', 'started', 'this', 'app', 'runs', 'continuously', 'until', 'a', 'force', 'stop', 'is', 'used', 'in', 'settings', 'applications', 'this', 'app', 'only', 'needs', 'to', 'run', 'on', 'demand', 'not', 'continuously', 'please', 'fix', 'this', 'flaw', 'it', 'affects', 'battery']","['generally', 'good', 'id', 'give', '5', 'stars', 'app', 'exit', 'option', 'started', 'app', 'runs', 'continuously', 'force', 'stop', 'used', 'settings', 'applications', 'app', 'needs', 'run', 'demand', 'continuously', 'please', 'fix', 'flaw', 'affects', 'battery']","['gener', 'good', 'id', 'give', '5', 'star', 'app', 'exit', 'option', 'start', 'app', 'run', 'continu', 'forc', 'stop', 'use', 'set', 'applic', 'app', 'need', 'run', 'demand', 'continu', 'pleas', 'fix', 'flaw', 'affect', 'batteri']","['generally', 'good', 'id', 'give', '5', 'star', 'app', 'exit', 'option', 'started', 'app', 'run', 'continuously', 'force', 'stop', 'used', 'setting', 'application', 'app', 'need', 'run', 'demand', 'continuously', 'please', 'fix', 'flaw', 'affect', 'battery']"
27,positive,"Just installed the app. My street number is 20. The app says I am 22, and I am sitting in the middle of my house.",Just installed the app My street number is 20 The app says I am 22 and I am sitting in the middle of my house,"['just', 'installed', 'the', 'app', 'my', 'street', 'number', 'is', '20', 'the', 'app', 'says', 'i', 'am', '22', 'and', 'i', 'am', 'sitting', 'in', 'the', 'middle', 'of', 'my', 'house']","['installed', 'app', 'street', 'number', '20', 'app', 'says', '22', 'sitting', 'middle', 'house']","['instal', 'app', 'street', 'number', '20', 'app', 'say', '22', 'sit', 'middl', 'hous']","['installed', 'app', 'street', 'number', '20', 'app', 'say', '22', 'sitting', 'middle', 'house']"
